REG_NO,NAME,NUMBER,STREET1,STREET2,TOWN,TOWNLAND,COUNTY,COUNTY_ID,PLANAUTH,COMPOSITION,APPRAISAL,DATEFROM,DATETO,RATING,ORIGINAL_TYPE,X_COORD,Y_COORD,X_COORD_ITM,Y_COORD_ITM,LATITUDE,LONGITUDE,IMAGE_LINK,WEBSITE_LINK,SURVEY_ID
20400820,Toomaghera Roman Catholic Church,,,,,KILMOON WEST,Clare,CL,CL,"Freestanding double-height Roman Catholic church, built c. 1860, comprising four-bay nave with gabled entrance porch and having recessed chancel.  Pitched artificial slate roof with cut-stone copings, corbels and cross finials.  Snecked cut-limestone walls with plinth.  Roughcast rendered walls to rear and end gable.  Chamfered limestone door surround with pair of timber doors.  Pointed arch openings with moulded limestone surrounds and replacement windows.  Graveyard to site with various cut-stone grave markers.  Ashlar gate piers to front.",,1850,1870,Regional,church/chapel,115562,199746,515531,699781,53.04200802,-9.259630104,http://www.buildingsofireland.ie/niah/images/survey_specific/fullsize/20400820_1.jpg,http://www.buildingsofireland.ie/niah/search.jsp?type=record&county=CL&regno=20400820,SURV023
20400821,Roadford Bridge,,,,,TEERGONEAN,Clare,CL,CL,"Six-arch rubble stone road bridge over river, built c. 1810, with cut-stone voussoirs and cutwaters.",,1800,1820,Regional,bridge,107997,197286,507968,697322,53.01866791,-9.371682713,http://www.buildingsofireland.ie/niah/images/survey_specific/fullsize/20400821_1.jpg,http://www.buildingsofireland.ie/niah/search.jsp?type=record&county=CL&regno=20400821,SURV023
20400823,Doonnagore Castle,,,,,DOONNAGORE,Clare,CL,CL,"Freestanding circular-plan single-bay three-stage tower house, built c. 1500.  Ruined in 1916, extensively reconstructed, c. 1970.  In use as private residence. Slate conical roof with metal finial.  Rubble stone walls with base batter, battlemented roof parapet and machicolation.  Gun loop openings.  Round-headed door opening.  Rubble stone bawn enclosure.  Cut-stone piers to front with iron gates.",,1450,1550,National,castle/fortified house,106915,195652,506885,695688,53.00380034,-9.387337397,http://www.buildingsofireland.ie/niah/images/survey_specific/fullsize/20400823_1.jpg,http://www.buildingsofireland.ie/niah/search.jsp?type=record&county=CL&regno=20400823,SURV023
20400825,Doolin Bridge,,,,,DOOLIN,Clare,CL,CL,"Twelve-span trabeated rubble stone road bridge over river, built c. 1775, with two  pedestrian refuges, cut-stone cutwaters, lintels and limestone parapet walls.  Concrete replacement slabs spanning five bays to right-hand side of upstream elevation.",,1750,1800,Regional,bridge,107555,197028,507526,697063,53.01627101,-9.378191378,http://www.buildingsofireland.ie/niah/images/survey_specific/fullsize/20400825_1.jpg,http://www.buildingsofireland.ie/niah/search.jsp?type=record&county=CL&regno=20400825,SURV023
20400901,Saint Mochua's  Church,,,,,NOUGHAVAL (BURREN),Clare,CL,CL,"Freestanding gable-fronted double-height church, built c. 1840, with gabled entrance porch, bellcote, six-bay nave elevations, advanced confessional and projecting sacristy.  Originally Church of Ireland church sited at Ballyvaughan, dismantled and reconstructed as a Roman Catholic church on present site, 1943.  Pitched slate roof with cast-iron rainwater goods, gable copings and cut-stone bellcote.  Chimneystack to sacristy.  Snecked limestone walls with quoins.  Lancet openings with cut-stone architraves and replacement uPVC windows.  Pointed arch opening with cut-stone architrave, timber matchboard door and strap hinges.  Cut-stone gate piers set in irregular coursed stone walls to site.",,1830,1850,Regional,church/chapel,120760,196724,520728,696760,53.01565849,-9.181406604,http://www.buildingsofireland.ie/niah/images/survey_specific/fullsize/20400901_1.jpg,http://www.buildingsofireland.ie/niah/search.jsp?type=record&county=CL&regno=20400901,SURV023
20400902,Hollywell House,,,,,MARYVILLE,Clare,CL,CL,"Detached five-bay two-storey house, built c. 1790, with four-bay two-storey return.  Top floor reputedly removed, c. 1910.  Pitched slate roof with cut-stone chimneystacks and gable copings.  Lime-washed rubble stone walls.  Round-headed door opening flanked by sidelights with cut-limestone Gibbsian surround and timber panelled door.  Timber sliding sash windows.  Retaining interior features.  Detached four-bay single-storey rubble stone-built outbuilding and cut-stone piers with moulded cappings to site.  Cobbled yard to rear.",,1780,1800,Regional,house,119266,194412,519234,694448,52.99466134,-9.20309047,http://www.buildingsofireland.ie/niah/images/survey_specific/fullsize/20400902_1.jpg,http://www.buildingsofireland.ie/niah/search.jsp?type=record&county=CL&regno=20400902,SURV023
20400903,Ballykeel House,,,,,BALLYKEEL SOUTH,Clare,CL,CL,"Detached five-bay two-storey over basement house, built c. 1800, with three-bay full-height bowed central section front and rear elevations.  Hipped artificial slate roof with rendered chimneystacks and moulded eaves course.  Cut-limestone walls with raised architraves, aprons to ground floor windows and string course at sill level first floor of bow.  Timber sliding sash windows.  Tuscan columns flanking timber panelled door with simple entablature above.  Curved cut-limestone walls to basement area and to steps leading to entrance.  Retaining interior features.  Four cast-iron chute covers to cellars with high relief motifs.  Flagged basement area with cut-stone vaulted recesses in external retaining wall.  Detached single-bay two-storey gable-fronted outbuilding with pinnacles and eight-bay side elevations.  Detached four-bay single-storey byre with segmental-arched openings.  Freestanding two-bay single-storey folly with lancet openings, now in ruins.  Gateway to front comprising four cut-limestone piers and pair of square-headed pedestrian gates set in curved walls.",,1790,1810,National,house,117817,194823,517786,694859,52.99813734,-9.224763325,http://www.buildingsofireland.ie/niah/images/survey_specific/fullsize/20400903_1.jpg,http://www.buildingsofireland.ie/niah/search.jsp?type=record&county=CL&regno=20400903,SURV023
20400904,Fanta Deanery,,,,,FANTA GLEBE,Clare,CL,CL,"Detached three-bay two-storey former glebe house, built c. 1790, with central porch and single-bay single-storey return.  Now in use as private house.  Pitched slate roof with rendered chimneystacks and gable copings.  Roughcast rendered walls with slate hanging to gables.  Cut stone walls to porch.  Timber sliding sash windows.  Retaining interior features.  Cut-stone gate piers with iron gates to site.",,1780,1800,Regional,rectory/glebe/vicarage/curate's house,117146,194580,517115,694616,52.99585066,-9.23469077,http://www.buildingsofireland.ie/niah/images/survey_specific/fullsize/20400904_1.jpg,http://www.buildingsofireland.ie/niah/search.jsp?type=record&county=CL&regno=20400904,SURV023
20400905,Ballyshanny House,,,,,BALLYSHANNY,Clare,CL,CL,"Detached three-bay two-storey house, built c. 1810, with two-bay single-storey flanking wings.  Renovated internally, c. 1850.  Flat-roofed projecting glazed porch added to front, c. 1960.  Pitched Moher flagged roof with cut-stone chimneystacks and gable copings.  Roughcast rendered walls with string course at sill level first floor.  Replacement timber windows.  Retaining interior features.  Cut-limestone piers with cast-iron gates to site.",,1800,1820,Regional,house,118714,195015,518682,695050,52.99999309,-9.211465711,http://www.buildingsofireland.ie/niah/images/survey_specific/fullsize/20400905_1.jpg,http://www.buildingsofireland.ie/niah/search.jsp?type=record&county=CL&regno=20400905,SURV023
20400909,Noughaval Market Stone,,,,,NOUGHAVAL (BURREN),Clare,CL,CL,"Freestanding cut-stone market stone, erected c. 1725, comprising octagonal-profile pier set on a stepped plinth and with tapered cap.",,1700,1750,Regional,monument,120785,196757,520753,696792,53.01595564,-9.181047892,http://www.buildingsofireland.ie/niah/images/survey_specific/fullsize/20400909_1.jpg,http://www.buildingsofireland.ie/niah/search.jsp?type=record&county=CL&regno=20400909,SURV023
20401001,Saint Columba's Roman Catholic Church,,,,,CRUGHWILL,Clare,CL,CL,"Freestanding double-height Roman Catholic church, dated 1861, with gable to roadside, four-bay nave elevations, two-bay single-storey porch to right and two-bay single-storey sacristy to rear.  Pitched slate roof with cross finial and bellcote.  Roughcast rendered walls with render plat bands.  Leaded glass with timber Y-tracery set in lancet openings.  Pointed arch and square-headed door openings with timber matchboard doors having wrought-iron strap hinges.  Retaining interior features.  Cut-stone stone gate piers with moulded caps, set in rendered boundary walls.",,1860,1865,Regional,church/chapel,127828,199064,527794,699099,53.03767903,-9.076647618,http://www.buildingsofireland.ie/niah/images/survey_specific/fullsize/20401001_1.jpg,http://www.buildingsofireland.ie/niah/search.jsp?type=record&county=CL&regno=20401001,SURV023
20401003,Glenquin House,,,,,POULNALOUR,Clare,CL,CL,"Detached three-bay two-storey house, built c. 1860, with two-bay two-storey return and attached single-bay single-storey outbuilding to rear.  Hipped slate roof with rendered chimneystacks and cut-stone eaves course.  Roughcast rendered walls.  Segmental-arched door opening with timber panelled door, fanlight and sidelights.  Timber sliding sash windows.  Retaining interior features.  Cast-iron piers with cast-iron gates and railings to site.",,1840,1880,Regional,house,130871,195989,530836,696024,53.01045135,-9.030634964,http://www.buildingsofireland.ie/niah/images/survey_specific/fullsize/20401003_1.jpg,http://www.buildingsofireland.ie/niah/search.jsp?type=record&county=CL&regno=20401003,SURV023
20401101,All Saints Roman Catholic Church,,,,,KYLECREEN,Clare,CL,CL,"Freestanding gable-fronted double-height Roman Catholic church, built c. 1850, with three-bay side elevations.  Lean-to bay added to rear, c. 1995.  Pitched artificial slate roof with aluminium rainwater goods and cross finial.  Cut-limestone entrance front with roughcast rendered walls to sides and rendered walls to rear.  Pointed arch opening with cut-limestone surround and replacement timber panelled double leaf doors.  Lancet windows with leaded coloured glass.  Tripartite window arrangement to entrance and chancel elevations.  Chancel openings partly blocked to accommodate reredos.  Retaining interior features.  Inscribed stone plaque in church ""This monument was erected by a few of the parishioners of Kilkeedy in memory of their P.P., the Rev. Podl who died Sept 27th. 1836 requiscat in pace amen"". Freestanding concrete belfry to site comprising square-profile columns with domed roof and concrete statue.  Remains of cut-stone bellcote, c. 1850, to site.",,1840,1860,Regional,church/chapel,137475,198178,537439,698213,53.03093559,-8.932683056,http://www.buildingsofireland.ie/niah/images/survey_specific/fullsize/20401101_1.jpg,http://www.buildingsofireland.ie/niah/search.jsp?type=record&county=CL&regno=20401101,SURV023
20401104,M. O'Grady,,,,,CARROWCRAHEEN,Clare,CL,CL,"Detached four-bay two-storey house, built c. 1890, originally two-bay two-storey thatched post office, now also in use as public house.  Renovated and extended to right, c. 1940, with render pubfront inserted to left ground floor.  Extended to right, c. 1970, with two-bay single-storey annexe added to left.  Pitched slate roof with rendered chimneystacks, concrete gable copings and cast-iron rainwater goods.  Lined-and-ruled rendered walls with render quoins and moulded render architraves.  Render shopfront comprising paired pilasters flanking openings with vermiculated capital panels, lettering and moulded cornice above.  Chamfered reveals to openings with replacement fittings.  Attached garage, built c. 1970, to right.  Petrol pump to front.",,1880,1900,Regional,house,140257,194280,540221,694316,52.99623099,-8.89049985,http://www.buildingsofireland.ie/niah/images/survey_specific/fullsize/20401104_1.jpg,http://www.buildingsofireland.ie/niah/search.jsp?type=record&county=CL&regno=20401104,SURV023
20401302,Bleach Bridge,,,,,ISLAND MORE,Clare,CL,CL,"Single-arch cut-limestone road bridge over river, built c. 1840, with voussoirs and coursed limestone parapet walls.",,1820,1860,Regional,bridge,157013,195708,556973,695744,53.01066604,-8.641159357,http://www.buildingsofireland.ie/niah/images/survey_specific/fullsize/20401302_1.jpg,http://www.buildingsofireland.ie/niah/search.jsp?type=record&county=CL&regno=20401302,SURV023
20401401,Seamount House,,,,,CLOGHAUNDINE,Clare,CL,CL,"Detached three-bay single-storey gate lodge, built c. 1810, with gabled advanced central entrance bay.  Hipped Moher flagged roof with rendered chimneystack.  Rendered walls with label mouldings over openings.  Paired timber sliding sash windows and timber panelled door.  Canted bay window to side elevation.  Gateway to front comprising eight cut-stone piers with curved walls and cast-iron gates and railings.",,1800,1820,Regional,gate lodge,105881,188573,505852,688611,52.94003184,-9.400677201,http://www.buildingsofireland.ie/niah/images/survey_specific/fullsize/20401401_1.jpg,http://www.buildingsofireland.ie/niah/search.jsp?type=record&county=CL&regno=20401401,SURV023
20401402,O'Brien's Column,,,,,DERREEN (CORCOMROE),Clare,CL,CL,"Freestanding limestone cut-stone monument, erected 1853, comprising fluted Doric column surmounted by an urn and set on a square-profile plinth with inscribed plaques.",,1850,1855,Regional,monument,104436,189929,504408,689966,52.95195641,-9.422552504,http://www.buildingsofireland.ie/niah/images/survey_specific/fullsize/20401402_1.jpg,http://www.buildingsofireland.ie/niah/search.jsp?type=record&county=CL&regno=20401402,SURV023
20401403,Saint Brigid's School,,,,,DERREEN (CORCOMROE),Clare,CL,CL,"Detached H-plan five-bay single-storey former school, built c. 1845, comprising three recessed central bays with veranda and gablet, flanked by gabled and canted end bays.  Now in use as pair of houses with dormer attic and rear porch additions.  Pitched slate roofs with rendered chimneystacks and decorative bargeboards.  Rendered walls with label mouldings over openings and inset plaques over door openings.  Cast-iron columns to veranda.  Clock set in brick surround to gable.  Timber and uPVC windows with stone sills.  Cut-limestone block-and-start chamfered doorcase with timber matchboard door.  Octagonal cut-stone gate piers and iron gate to site set in painted stone wall.",,1840,1850,Regional,school,104238,189629,504209,689666,52.94922305,-9.425421028,http://www.buildingsofireland.ie/niah/images/survey_specific/fullsize/20401403_1.jpg,http://www.buildingsofireland.ie/niah/search.jsp?type=record&county=CL&regno=20401403,SURV023
20401404,,,,,,ARDNACRAA,Clare,CL,CL,"Freestanding single-bay single-storey Gothic Revival well house, built c. 1820.  Stone flagged flat roof with cut-stone crenellated parapet and central finial.  Dressed stone walls with string course and carved stone plaque.  Pointed arch opening with cut-limestone surround and remains of wrought-iron gate.",,1810,1830,Regional,well,104543,190375,504514,690412,52.95598441,-9.421095725,http://www.buildingsofireland.ie/niah/images/survey_specific/fullsize/20401404_1.jpg,http://www.buildingsofireland.ie/niah/search.jsp?type=record&county=CL&regno=20401404,SURV023
20401405,Birchfield House,,,,,TEERGONEAN,Clare,CL,CL,"Gateway, built c. 1800, comprising four cut-stone piers set in curved rubble stone walls having pair of square-headed pedestrian gates and cast-iron double leaf gates. Detached three-bay single-storey gate lodge, built c. 1800, now in ruins.  Remains of detached five-bay two- and three-storey rubble stone-built Gothic Revival house, built by Cornelius O’Brien MP c. 1800, now in ruins.  Group of detached multiple-bay single-storey outbuildings to site, now in ruins.",,1780,1820,Regional,gates/railings/walls,108556,189442,505367,688960,52.94308311,-9.407987109,http://www.buildingsofireland.ie/niah/images/survey_specific/fullsize/20401405_1.jpg,http://www.buildingsofireland.ie/niah/search.jsp?type=record&county=CL&regno=20401405,SURV023
20401406,Saint Bridget's Well,,,,,BALLYSTEEN,Clare,CL,CL,"Holy well, built c. 1830.  Detached single-bay single-storey lean-to building.  Liscannor flagged single-pitched roof with concrete coping, rendered chimneystacks, and having timber beams to flat roof over corridor to well.  Rendered and rubble stone wall.  Timber matchboard door to building.  Segmental-arched opening to well.  Numerous votive offerings to interior.  Stream falls over Liscannor flags to well.",,1820,1840,Regional,holy well,104456,189955,504427,689992,52.9521905,-9.42226806,http://www.buildingsofireland.ie/niah/images/survey_specific/fullsize/20401406_1.jpg,http://www.buildingsofireland.ie/niah/search.jsp?type=record&county=CL&regno=20401406,SURV023
20401408,O'Brien's Tower,,,,,LISLORKAN NORTH,Clare,CL,CL,"Freestanding dressed stone Gothic Revival style folly, built 1835, comprising circular-plan single-bay two-stage tower with battered base to centre and battlemented roof parapet, flanked by circular-plan single-bay two-storey lower tower to left and single-bay single-storey battlemented screen wall to right having segmental-arched door opening.  Built by Cornelius O’Brien M.P. Spectacularly sited on the Cliffs of Moher.",,1830,1840,Regional,folly,103900,192289,503872,692326,52.97306033,-9.431226023,http://www.buildingsofireland.ie/niah/images/survey_specific/fullsize/20401408_1.jpg,http://www.buildingsofireland.ie/niah/search.jsp?type=record&county=CL&regno=20401408,SURV023
20401501,Saint Augustine's Roman Catholic Church,,,,,CARROWERAGH,Clare,CL,CL,"Freestanding T-plan double-height Roman Catholic church, built 1893, with two-bay gable front having projecting entrance porch, four-bay nave elevations, transept to right and sacristy to left.  Pitched artificial slate roof with cut-stone bellcote, finials and gable copings.  Rendered walls with buttresses, string courses and plat bands.  Lancet openings with timber sliding sash windows.  Pointed arch door openings with timber double leaf doors.  Retaining interior features.  Rubble stone boundary walls to site with cut-stone gate piers and cast-iron gates.",,1890,1895,Regional,church/chapel,112710,192980,512680,693016,52.98077052,-9.300308211,http://www.buildingsofireland.ie/niah/images/survey_specific/fullsize/20401501_1.jpg,http://www.buildingsofireland.ie/niah/search.jsp?type=record&county=CL&regno=20401501,SURV023
20401503,O'Brien's Bridge,,,,,,Clare,CL,CL,"Triple-arch cut-stone stone road bridge over estuary of river Inagh, dated 1836, with voussoirs, single and paired pilasters and V-cutwaters.",,1835,1840,Regional,bridge,109113,189317,509083,689354,52.94726553,-9.352830113,http://www.buildingsofireland.ie/niah/images/survey_specific/fullsize/20401503_1.jpg,http://www.buildingsofireland.ie/niah/search.jsp?type=record&county=CL&regno=20401503,SURV023
20401504,Sandfield Lodge,,,,,KNOCKNARAHA,Clare,CL,CL,"Detached five-bay single-storey house, built c. 1775.  Originally three-bay with round-headed door opening to centre and two-storey rear elevation.  Extended, c. 1820, with single-bay single-storey flanking wings.  Renovated, c. 1880, with three-bay single-storey open arcaded porch added to front.  Pitched and hipped slate roofs with rendered chimneystacks.  Rendered walls.  Replacement fittings to openings.  Retaining interior features.",,1750,1800,Regional,house,108286,190163,508256,690200,52.95472856,-9.365363203,http://www.buildingsofireland.ie/niah/images/survey_specific/fullsize/20401504_1.jpg,http://www.buildingsofireland.ie/niah/search.jsp?type=record&county=CL&regno=20401504,SURV023
20401506,,,,,,LISCANNOR,Clare,CL,CL,"Harbour comprising pair of cut-stone enclosing piers, built c. 1830, and c. 1880.  Cast-iron lamp standards, bollards and inset ladders.",,1820,1840,Regional,harbour/dock/port,106770,188329,506741,688366,52.93799383,-9.387383663,http://www.buildingsofireland.ie/niah/images/survey_specific/fullsize/20401506_1.jpg,http://www.buildingsofireland.ie/niah/search.jsp?type=record&county=CL&regno=20401506,SURV023
20401507,Saint Brigid's Roman Catholic Church,,,,,LISCANNOR,Clare,CL,CL,"Freestanding double-height Roman Catholic church, dated 1858, comprising four-bay nave with central gabled entrance porch.  Three-bay single-storey sacristy added to rear, c. 1985.  Pitched artificial slate roof with cross finials and cast-iron rainwater goods.  Cut-stone copings to porch roof.  Snecked stone walls.  Cut-stone quoins to porch.  Rendered walls to rear.  Timber matchboard door.  Lancet windows with timber Y-tracery and leaded stained glass.  Tripartite window to west gable.  Retaining interior features including raked galleries, clustered cast-iron piers and carved marble altar.  Graveyard to site with various cut-stone grave markers.  Octagonal cut-stone piers with moulded cappings and cast-iron gates.",,1855,1860,Regional,church/chapel,106352,188304,506323,688342,52.93769693,-9.393595162,http://www.buildingsofireland.ie/niah/images/survey_specific/fullsize/20401507_1.jpg,http://www.buildingsofireland.ie/niah/search.jsp?type=record&county=CL&regno=20401507,SURV023
20401509,New Bridge,,,,,KILLASPUGLONANE,Clare,CL,CL,"Triple-arch road bridge over river, built c. 1840.  Irregularly coursed stone walls with cut-stone voussoirs, double-keystones, U-cutwaters, end piers and copings.  Concrete pipes and casings to upstream side of bridge.",,1820,1860,Regional,bridge,110608,190163,510578,690200,52.95512329,-9.330828374,http://www.buildingsofireland.ie/niah/images/survey_specific/fullsize/20401509_1.jpg,http://www.buildingsofireland.ie/niah/search.jsp?type=record&county=CL&regno=20401509,SURV023
20401601,Saint Fachanan's Roman Catholic Church,,,,,KILCARRAGH,Clare,CL,CL,"Freestanding cruciform-plan Roman Catholic church, built c. 1865, comprising gable-fronted entrance with projecting porch, rose window and bellcote, three-bay side elevations, single-bay transepts and chancel to rear having two-bay single-storey sacristy.  Pitched artificial slate roof with clay crestings, cross finials, concrete copings, cut-stone bellcote and cast-iron downpipe.  Lined-and-ruled rendered walls with render quoins.  Carved limestone rose window with hood moulding and stained glass.  Round-headed door opening with raised render surround, timber matchboard door and fanlight.  Lancet windows with leaded coloured glass.  Retaining interior features.  Rendered boundary walls with cast-iron double leaf gates.  Wheel guards to corners.",,1860,1870,Regional,church/chapel,118173,193920,518141,693956,52.99008144,-9.21924443,http://www.buildingsofireland.ie/niah/images/survey_specific/fullsize/20401601_1.jpg,http://www.buildingsofireland.ie/niah/search.jsp?type=record&county=CL&regno=20401601,SURV023
20401605,Kilfenora Cathedral,,,,,KILFENORA,Clare,CL,CL,"Freestanding crow-stepped gable-fronted Church of Ireland cathedral, built from 1170-1200, incorporating fabric of earlier buildings.  Four-bay side elevations with single-bay recessed chancel to rear, having single-bay vestry to left.  In ruins in 1840 and reconstructed c. 1850.  Chancel and vestry now in ruins.  Pitched artificial slate roof with bellcote having pyramidal capping and flanking finials.  Rubble stone walls with slight batter to gable front.  Lancet openings with cut-stone dressings and timber sliding sash and fixed windows.  Pointed arch door opening with timber cut-limestone dressings, hood moulding and timber panelled door.  Retaining interior features.  Graveyard to site with various grave markers.  Rubble stone boundary walls.",,1170,1200,National,cathedral,118280,194011,518249,694047,52.99091283,-9.217664607,http://www.buildingsofireland.ie/niah/images/survey_specific/fullsize/20401605_1.jpg,http://www.buildingsofireland.ie/niah/search.jsp?type=record&county=CL&regno=20401605,SURV023
20401606,Church of Saint Attracta,,,,,TOORMORE (CORCOMROE),Clare,CL,CL,"Freestanding double-height Roman Catholic church, built c. 1870, with three-bay nave elevation, polygonal chancel and sacristy to rear.  Pitched artificial slate roof with rendered bellcote and cast-iron rainwater goods.  Rendered walls.  Round-headed openings with timber framed windows and concrete sills.  Retaining interior features including marble altar and timber altar rails.  Rendered boundary walls to site with stiles and gates.",,1850,1890,Regional,church/chapel,121632,190782,521599,690819,52.96240434,-9.166987603,http://www.buildingsofireland.ie/niah/images/survey_specific/fullsize/20401606_1.jpg,http://www.buildingsofireland.ie/niah/search.jsp?type=record&county=CL&regno=20401606,SURV023
20401710,Clifden House,,,,,CLIFDEN,Clare,CL,CL,"Detached seven-bay two-storey over basement house, built c. 1800.  Hipped artificial slate roof with cut-stone chimneystacks.  Lime rendered walls with blind niche over entrance.  Timber sliding sash windows.  Carved limestone doorcase comprising engaged Tuscan columns flanking moulded architrave and timber panelled door, having entablature with rosettes above.  Retaining interior features.  Attached eight-bay single-storey stable range with half-dormer attic to right, now in use as house.  Detached two-bay three-storey gable-fronted former mill to site, now in ruins.  Cast-iron piers with wrought-iron gates to site.",,1780,1820,Regional,house,126602,189145,526568,689182,52.94840066,-9.092671027,http://www.buildingsofireland.ie/niah/images/survey_specific/fullsize/20401710_1.jpg,http://www.buildingsofireland.ie/niah/search.jsp?type=record&county=CL&regno=20401710,SURV023
