REG_NO,NAME,NUMBER,STREET1,STREET2,TOWN,TOWNLAND,COUNTY,COUNTY_ID,PLANAUTH,COMPOSITION,APPRAISAL,DATEFROM,DATETO,RATING,ORIGINAL_TYPE,X_COORD,Y_COORD,X_COORD_ITM,Y_COORD_ITM,LATITUDE,LONGITUDE,IMAGE_LINK,WEBSITE_LINK,SURVEY_ID
20403305,Saint Joseph's Roman Catholic Church,,,,,BALLYNABINNIA,Clare,CL,CL,"Freestanding gable-fronted double-height Roman Catholic church, built 1842, with three-bay side elevations.  Projecting porch added to entrance and sacristy added to rear, 1969.  Pitched artificial slate with metal cross finials.  Roughcast rendered walls with cut-stone quoins.  Lancet opening with cut-stone surrounds and leaded glass.  Timber doors.  Retaining interior features.   Brass plaque in porch : ""This porch has been erected / as a memorial to the late Mike McTigue / World light heavyeight champion boxer / 1923-25  by his friends in the USA / born in Kilnamona 1892 died in New York 1966 /R.I.P. / Dec. 1969"".  Cast-iron belfry to site.  Cut-stone gate piers set in rubble stone crenellated boundary walls.",,1840,1845,Regional,church/chapel,127440,180131,527406,680170,52.86753479,-9.078192931,http://www.buildingsofireland.ie/niah/images/survey_specific/fullsize/20403305_1.jpg,http://www.buildingsofireland.ie/niah/search.jsp?type=record&county=CL&regno=20403305,SURV023
20403309,Inch Bridge,,,,,INCH MORE,Clare,CL,CL,"Five-arch rubble stone road bridge over river, built c. 1830, with cut-stone voussoirs and keystones.",,1820,1840,Regional,bridge,130209,175383,530174,675423,52.82523641,-9.036069662,http://www.buildingsofireland.ie/niah/images/survey_specific/fullsize/20403309_1.jpg,http://www.buildingsofireland.ie/niah/search.jsp?type=record&county=CL&regno=20403309,SURV023
20403310,Cahercalla House,,,,,CAHIRCALLA MORE,Clare,CL,CL,"Detached five-bay two-storey former house, built c. 1810, with pedimented central breakfront having flat-roofed projecting porch.  Now in use as hospital.  Fourteen-bay three-storey flat-roofed wing added to left hand side and six-bay two-storey wing added to right hand side, 1953.  Hipped artificial slate roof with eaves consoles and cast-iron rainwater goods.  Rendered walls with render quoins, render architraves, consoled entablatures over ground floor opening and moulded eaves course.  Moulded cornice and label mouldings over round-headed openings to porch.  Timber sliding sash windows and timber panelled door.  Detached three-bay single-storey outbuilding to site.",,1800,1820,Regional,house,132401,176205,532366,676245,52.83290291,-9.003727769,http://www.buildingsofireland.ie/niah/images/survey_specific/fullsize/20403310_1.jpg,http://www.buildingsofireland.ie/niah/search.jsp?type=record&county=CL&regno=20403310,SURV023
20403313,Our Lady's Hospital,,Gort Road,,Ennis,DULICK,Clare,CL,CL,"Detached symmetrical-plan thirty-three-bay three-storey over basement former mental asylum, completed 1868, comprising five-bay projecting central block with single-bay four-stage advanced central tower, flanked by recessed fourteen-bay wings with three-bay projecting blocks and three-bay projecting end blocks, having single-bay four-stage towers to rear.  Pair of five-bay two-storey returns with dormer attics having two-storey half-octagonal projecting end bays added to rear, c. 1900.  Now in use as hospital.  Hipped slate roofs with cut-stone dentillated eaves courses.  Snecked limestone walls with cut-stone quoins, plinth and eaves band.  Channelled limestone with string course above to ground floor breakfront.  Segment-arched openings with cut-stone architraves and sills and timber sliding sash windows.  Tuscan columns and pilasters with entablature flanking timber glazed door having overlight and sidelights.  Detached two-bay single-storey rusticated limestone gate lodge with single-bay canted bay window to left and segmental-headed door opening to right.  Detached T-plan five-bay double-height chapel, built c. 1930.  Retaining interior features.  Cut-limestone gate piers.  Designed by Fogerty and Adair.",,1865,1870,Regional,hospital/infirmary,134114,179242,534078,679281,52.86040157,-8.978927739,http://www.buildingsofireland.ie/niah/images/survey_specific/fullsize/20403313_1.jpg,http://www.buildingsofireland.ie/niah/search.jsp?type=record&county=CL&regno=20403313,SURV023
20403315,Ballymacquiggan Bridge,,,,,INCH MORE,Clare,CL,CL,"Double-arch limestone road bridge over river, built c. 1830, with cut-stone voussoirs and stile incorporated in wall.  Partly reconstructed, c. 1990, retaining original materials.",,1820,1840,Regional,bridge,132596,180466,532561,680505,52.87121227,-9.001713818,http://www.buildingsofireland.ie/niah/images/survey_specific/fullsize/20403315_1.jpg,http://www.buildingsofireland.ie/niah/search.jsp?type=record&county=CL&regno=20403315,SURV023
20403401,Toonagh House,,,,,TOONAGH (BUNRATTY UPPER),Clare,CL,CL,"Detached four-bay two-storey house, built c. 1800.  Pitched slate roof with rendered chimneystacks.  Roughcast rendered walls with render quoins and architraves.  Replacement windows and door.  Detached single-bay single-storey gable-fronted rubble stone dovecote with segmental-headed door opening, possibly formerly in use as mill, now in ruins.  Single-arch cut-stone bridge over stream with cut-stone voussoirs and pyramidal copings.",,1775,1825,Regional,house,143990,177654,543952,677694,52.84725433,-8.832047203,http://www.buildingsofireland.ie/niah/images/survey_specific/fullsize/20403401_1.jpg,http://www.buildingsofireland.ie/niah/search.jsp?type=record&county=CL&regno=20403401,SURV023
20403402,Moyriesk House,,,,,MOYRIESK,Clare,CL,CL,"Remains of detached three-bay two-storey house, built c. 1790, originally part of larger building, now derelict and in use as outbuilding.  Hipped slate roof with brick chimneystacks and dentillated eaves course.  Hipped slate roof to former entrance canopy.  Lined-and-ruled rendered walls to ground floor and red brick English garden bond walls to first floor with string courses and cut-stone quoins.  Remains of timber sliding sash windows, metal sheeting and boarding to openings.",,1780,1800,Regional,house,140914,177319,540878,677359,52.84391502,-8.877624614,http://www.buildingsofireland.ie/niah/images/survey_specific/fullsize/20403402_1.jpg,http://www.buildingsofireland.ie/niah/search.jsp?type=record&county=CL&regno=20403402,SURV023
20403405,Kilbreckam Silver Mines,,,,,MONANOE,Clare,CL,CL,"Remains of silver mines, in use c. 1775, disused, pre-1921.  Detached single-bay three-storey rubble stone building, now in ruins.  Freestanding circular-profile rubble stone chimney with red brick dressings, now overgrown.",,1750,1800,Regional,mine/pit,139833,176103,539797,676142,52.83286389,-8.893440692,http://www.buildingsofireland.ie/niah/images/survey_specific/fullsize/20403405_1.jpg,http://www.buildingsofireland.ie/niah/search.jsp?type=record&county=CL&regno=20403405,SURV023
20403517,Tyredagh Spa House,,,,,BALLYBLOOD,Clare,CL,CL,"Detached three-bay single-storey house with dormer attic, built 1879, with gabled projecting central entrance bay.  Gable-fronted single-bay single-storey extension with dormer attic added to right hand side, c. 1990.  Pitched slate roof with timber finials, red brick chimneystacks, timber bargeboard to gable and cast-iron rainwater goods.  Pitched artificial slate to extension.  Rendered walls.  Replacement uPVC windows.  Round-headed door opening with timber panelled door having glazed panels and plain fanlight.  Wrought-iron gate and piers set in rubble stone walls.",,1875,1880,Regional,house,148852,175662,548813,675702,52.82984088,-8.759580654,http://www.buildingsofireland.ie/niah/images/survey_specific/fullsize/20403517_1.jpg,http://www.buildingsofireland.ie/niah/search.jsp?type=record&county=CL&regno=20403517,SURV023
20403518,Derrymore House,,,,,DERRYMORE EAST,Clare,CL,CL,"Detached four-bay two-storey house, built c. 1800.  Single-bay two-storey flat-roofed return, added c. 1970.  Pitched slate roof with three rendered chimneystacks.  Pebbledashed walls to first floor, rendered walls to ground floor with rendered plat bands.  Timber sliding sash windows.  Replacement timber panelled door with multiple pane sidelight.  Rendered piers with wrought-iron gates to garden.  Cut-stone stone piers set in rendered boundary walls with cast-iron gates.",,1780,1820,Regional,house,151205,175437,551166,675477,52.82803257,-8.724641669,http://www.buildingsofireland.ie/niah/images/survey_specific/fullsize/20403518_1.jpg,http://www.buildingsofireland.ie/niah/search.jsp?type=record&county=CL&regno=20403518,SURV023
20403522,Cullan Castle,,,,,CLOONAHERNA,Clare,CL,CL,"Detached three-bay two-storey over basement house, dated 1782, with central breakfront and three-bay full-height bowed section to rear elevation.  Now in ruins.  Roof no longer in existence.  Dressed stone walls with carved plaque to breakfront and string course between floors.  Round-headed door opening with pilasters flanking opening, having cornice and archivolt above, now blocked.  Tripartite window opening comprising moulded architrave with columns forming mullions.  Rendered brick block-and-start surrounds to window openings.  Rubble stone former Roman Catholic chapel with lancet-arched openings, now in ruins.  Detached L-plan two-bay single-storey gate lodge with dormer attic, now derelict. Freestanding gazebo with a stepped base, now in ruins.",,1780,1785,Regional,country house,147385,174723,547347,674763,52.82125514,-8.781188062,http://www.buildingsofireland.ie/niah/images/survey_specific/fullsize/20403522_1.jpg,http://www.buildingsofireland.ie/niah/search.jsp?type=record&county=CL&regno=20403522,SURV023
20403525,Cloonteen House,,,,,CLOONTEEN (BUNRATTY UPPER),Clare,CL,CL,"Detached four-bay single- and two-storey former estate worker's house with dormer attic, built c. 1875, comprising two-bay two-storey block with two-bay single-storey wing having dormer attic.  Now in use as private house.  Pitched slate roof with cast-iron rainwater goods, rendered and red brick chimneystacks and gabled dormer.  Rendered walls with inscribed plaque.  Timber sliding sash windows.  Timber panelled door.  Detached multiple-bay single-storey rubble stone outbuilding with round-headed integral carriage arches, built c. 1875.  Detached three-bay single-storey former gate lodge with gabled projecting porch to centre, c. 1890, now in use as private house.  Cut-stone gate piers to site.",,1870,1880,Regional,worker's house,147445,179215,547407,679254,52.86162411,-8.781016359,http://www.buildingsofireland.ie/niah/images/survey_specific/fullsize/20403525_1.jpg,http://www.buildingsofireland.ie/niah/search.jsp?type=record&county=CL&regno=20403525,SURV023
20403527,Derrymore House,,,,,CLOGHER (CORCOMROE),Clare,CL,CL,"Detached three-bay single-storey cut-limestone gate lodge with prostyle tetrastyle pedimented Doric portico, built c. 1820, now vacant.  Pitched slate roof with cut-stone chimneystack.  Cut-limestone walls to front with carved detail to portico.  Dressed stone walls to side.  Timber sliding sash windows.  Door opening now blocked.  Cut-stone piers and boundary walls to site.",,1800,1840,Regional,gate lodge,154799,179168,554759,679207,52.86187432,-8.671843842,http://www.buildingsofireland.ie/niah/images/survey_specific/fullsize/20403527_1.jpg,http://www.buildingsofireland.ie/niah/search.jsp?type=record&county=CL&regno=20403527,SURV023
20403601,Derrymore House,,,,,CLOGHER (CORCOMROE),Clare,CL,CL,"Detached five-bay two-storey house, built c. 1820, incorporating fabric of earlier building, c. 1650.  Originally the servants' wings of larger house, demolished 1937.  Four-bay single-storey lean-to projecting bay with pair of internal porches, added c. 1985.  Pitched slate roof with cast-iron rainwater goods and four red brick chimneystacks.  Pitched artificial slate roof to extension.  Rubble stone and rendered walls.  Timber sliding sash windows.  Timber casement windows to extension.  Glazed timber panelled doors.  Detached sixteen-bay two-storey rubble stone outbuilding, c. 1820, with pair of segmental-headed integral carriageways and single-bay single-storey crenellated connecting screen wall to left.  Detached eight-bay two-storey coursed stone barrel-roofed outbuilding, c. 1820, with segmental-headed integral carriageway.",,1800,1840,Regional,country house,155433,179659,555393,679698,52.86633833,-8.662493753,http://www.buildingsofireland.ie/niah/images/survey_specific/fullsize/20403601_1.jpg,http://www.buildingsofireland.ie/niah/search.jsp?type=record&county=CL&regno=20403601,SURV023
20403701,Saint Mary's Roman Catholic Church,,,,,BALLYLAGHNAN,Clare,CL,CL,"Freestanding T-plan gable-fronted double-height Roman Catholic church, built c. 1840, with single-bay nave and single-bay transepts.  Pitched slate roof with metal cross finial and cast-iron rainwater goods.  Rendered walls with inset fonts.  Pointed arch openings with timber sliding sash windows.  Timber matchboard doors.  Retaining interior features.  Rusticated concrete block boundary walls.",,1820,1860,Regional,church/chapel,166971,180243,566929,680282,52.87241782,-8.491231957,http://www.buildingsofireland.ie/niah/images/survey_specific/fullsize/20403701_1.jpg,http://www.buildingsofireland.ie/niah/search.jsp?type=record&county=CL&regno=20403701,SURV023
20403702,Tinerana House,,,,,ISLANDCOSGRY,Clare,CL,CL,"Detached eight-bay two-storey over basement house with dormer attic, built c. 1860 by the Purdon family, with two-bay projecting back to left hand side and conservatory to right hand side.  Incorporating fabric of earlier building.  Now also in use as guesthouse.  Hipped skirt roof with eaves modillions, dormer windows, cut-stone sandstone chimneystacks and cast-iron rainwater goods.  Exposed sandstone walls with stringcourses.  Cut-stone sandstone doorcase with moulded chamfered reveals, double archivolts above, and pilasters retain springing stones of un-built portico.  Timber sliding sash windows, elongated to light staircase.  Timber casement windows to dormers.  Retaining interior features.",,1840,1880,Regional,country house,169761,179423,569718,679462,52.86521203,-8.449734839,http://www.buildingsofireland.ie/niah/images/survey_specific/fullsize/20403702_1.jpg,http://www.buildingsofireland.ie/niah/search.jsp?type=record&county=CL&regno=20403702,SURV023
20403705,,,,,,ISLANDCOSGRY,Clare,CL,CL,"Freestanding Church of Ireland church, built c. 1860, comprising three-bay nave with lean-to vestry and three-stage entrance tower.  Built by the Purdon family.  Rooflights added, c. 1985, to accommodate use as private house.  Pitched slate roof with rendered chimneystack, cast-iron rainwater goods and cut-stone gable copings.  Castellations and pinnacles to tower.  Exposed stone walls with quoins to nave and having string courses and chamfered corner pilasters to tower.  Pointed arch openings with cut-stone architraves and leaded windows.  Timber matchboard door.  Octagonal-profile font to front.  Graveyard to site.",,1840,1880,Regional,church/chapel,168968,178975,568926,679014,52.86114245,-8.46145547,http://www.buildingsofireland.ie/niah/images/survey_specific/fullsize/20403705_1.jpg,http://www.buildingsofireland.ie/niah/search.jsp?type=record&county=CL&regno=20403705,SURV023
20403801,Saint Mary's Roman Catholic Church,,,,,FINNOR MORE,Clare,CL,CL,"Freestanding T-plan gable-fronted double-height Roman Catholic church, built 1844, with four-bay side elevations having two-bay transepts with gabled projecting porches.  Pitched artificial slate roof.  Rendered walls.  Lancet openings with replacement uPVC windows.  Retaining interior features.  Concrete brick walls and piers added to site, c. 1970.",,1840,1845,Regional,church/chapel,104699,173049,504671,673089,52.80036465,-9.413701581,http://www.buildingsofireland.ie/niah/images/survey_specific/fullsize/20403801_1.jpg,http://www.buildingsofireland.ie/niah/search.jsp?type=record&county=CL&regno=20403801,SURV023
20403802,"Blessed Virgin Mary, Star of the Sea Church",,,,,QUILTY TOWN,Clare,CL,CL,"Freestanding T-plan Hiberno-Romanesque style Roman Catholic church, dated 1909, with two-bay transepts, round tower, porch and semi-circular-plan apse to right hand side.  Recessed single-bay added to left.  Pitched slate roof with carved eaves brackets and cast-iron rainwater goods.  Conical cut-stone stone roof to tower.  Half conical roof to apse.  Dressed stone walls with canted buttresses.  String course and plaque to tower.  Round-headed window openings.  Oculi to gables.  Pedimented round-headed doorcase to base of tower, with painted columns and timber matchboard door.  Retaining interior features.  Rubble stone boundary walls.  Church built in 1909 to commemorate wreck of French vessel Leon XIII in 1907 and the rescue of its crew by local men.  Bell of ship in altar.",,1905,1910,Regional,church/chapel,101517,174750,501489,674790,52.81507711,-9.461384837,http://www.buildingsofireland.ie/niah/images/survey_specific/fullsize/20403802_1.jpg,http://www.buildingsofireland.ie/niah/search.jsp?type=record&county=CL&regno=20403802,SURV023
20403901,Church of the Most Holy Redeemer,,,,,COOR WEST,Clare,CL,CL,"Freestanding gable-fronted double-height Roman Catholic church, dated 1865, with four-bay side elevations.  Projecting entrance porch and two-bay single-storey sacristy added to right, 1978.  Pitched artificial slate roof with sheeted timber soffits and aluminium rainwater goods.  Rendered walls with buttresses to east elevation.  Pointed openings with timber traceried windows and timber panelled double leaf doors.  Retaining interior features.  Graveyard and freestanding belfry to site.",,1860,1870,Regional,church/chapel,109212,173551,509182,673591,52.80565448,-9.346954615,http://www.buildingsofireland.ie/niah/images/survey_specific/fullsize/20403901_1.jpg,http://www.buildingsofireland.ie/niah/search.jsp?type=record&county=CL&regno=20403901,SURV023
20404001,Saint John's Roman Catholic Church,,,,,KILMALEY,Clare,CL,CL,"Freestanding T-plan gable-fronted double-height Roman Catholic church, built 1844, with three-bay side elevations having single-bay transepts.  Single-bay two-storey gabled projecting porch to front having concrete canopy, added, c. 1965.  Pitched artificial slate roof with sheeted eaves and aluminium rainwater goods.  Pebbledashed walls.  Lancet openings with leaded glass and timber matchboard doors.  Retaining interior features.  Cast-iron belfry to site.  Rubble stone crenellated boundary walls.",,1840,1845,Regional,church/chapel,125293,174858,525259,674898,52.81986413,-9.108861298,http://www.buildingsofireland.ie/niah/images/survey_specific/fullsize/20404001_1.jpg,http://www.buildingsofireland.ie/niah/search.jsp?type=record&county=CL&regno=20404001,SURV023
20404101,Saint John the Baptist's Roman Catholic Church,,,,,BALLYVULLAGAN,Clare,CL,CL,"Freestanding T-plan gable-fronted double-height Roman Catholic church, built 1857 with stepped central breakfront and three-bay side elevations having single-bay transepts.  Three-bay single-storey sacristy, added 1991.  Pitched artificial slate roof with cross finial.  Pebbledashed walls with lined-and-ruled render to breakfront.  Lancet openings with leaded glass and timber matchboard double-leaf doors.  Retaining interior features.  Detached two-bay single-storey rubble stone coach house with segmental-headed carriageway, now derelict.  Cut-stone piers and wrought-iron gates with crenellated boundary walls.",,1855,1860,Regional,church/chapel,130552,170703,530517,670744,52.78323306,-9.029986999,http://www.buildingsofireland.ie/niah/images/survey_specific/fullsize/20404101_1.jpg,http://www.buildingsofireland.ie/niah/search.jsp?type=record&county=CL&regno=20404101,SURV023
20404102,Teermaclane House,,,,,TEERMACLANE,Clare,CL,CL,"Detached four-bay two-storey house, built c. 1800, now in ruins.  Roof missing with brick eaves course.  Exposed coursed stone walls with cut-stone quoins and plinth.  Serlian door opening with cut-limestone dressings.  Attached single-bay single-storey rubble stone outbuilding to site.  Cut-stone architraves and keystones to window openings.",,1780,1820,Regional,house,131055,170303,531020,670344,52.77970388,-9.022448141,http://www.buildingsofireland.ie/niah/images/survey_specific/fullsize/20404102_1.jpg,http://www.buildingsofireland.ie/niah/search.jsp?type=record&county=CL&regno=20404102,SURV023
20404103,Barntick House,,,,,BARNTICK,Clare,CL,CL,"Detached three-bay two-storey house, dated 1661, and renovated c. 1740.  Hipped slate roof with red brick chimneystacks.  Roughcast rendered walls with string course between ground and first floors and moulded eaves course.  Timber sliding sash windows.  Carved limestone door surround comprising shouldered surround with entablature above, approached by flight of limestone steps.  Timber panelled double leaf doors.  Retaining interior features.  Attached single-bay single-storey outbuilding to right.  Date plaque from house moved to outbuilding.  Rendered gate piers to site with wrought-iron railings.",,1660,1665,National,house,132799,172263,532764,672304,52.79754089,-8.997002708,http://www.buildingsofireland.ie/niah/images/survey_specific/fullsize/20404103_1.jpg,http://www.buildingsofireland.ie/niah/search.jsp?type=record&county=CL&regno=20404103,SURV023
20404104,Buncraggy House,,,,,BUNCRAGGY,Clare,CL,CL,"Detached three-bay two-storey house, built c. 1780, with single-bay single-storey projecting porch, single-bay full-height canted bay windows and four-bay two-storey lower return to rear.  Hipped slate roof with brick chimneystacks.  Roughcast rendered walls.  Red brick walls to right hand side bay window.  Timber sliding sash windows.  Detached five-bay two-storey outbuilding with segmental-headed door opening having cut-stone surround and keystone.  Detached three-bay single-storey gate lodge with tripartite window openings, now derelict.  Cut-stone piers with cast-iron gates and railings.",,1760,1800,Regional,country house,132854,171275,532819,671316,52.78866466,-8.995995259,http://www.buildingsofireland.ie/niah/images/survey_specific/fullsize/20404104_1.jpg,http://www.buildingsofireland.ie/niah/search.jsp?type=record&county=CL&regno=20404104,SURV023
20404105,Church of Saint Peter and Saint Paul,,,,,CLARE COMMONS,Clare,CL,CL,"Freestanding T-plan double-height Roman Catholic church, built 1839, comprising gable-fronted nave with four-bay side elevations and single-bay transepts.  Triple gable-fronted blocks added to front, 1986, comprising glazed central atrium block flanked by rendered blocks.  Gable-fronted porches added to transepts, 1986.  Pitched artificial slate roof with cut-stone bellcote.  Rendered walls with render quoins.  Lancet openings with cut-stone block-and-start architraves and leaded glass.  Segmental-arched former door opening with label moulding.  Retaining interior features.  Rendered piers with pyramidal copings set in rubble stone wall.",,1835,1840,Regional,church/chapel,134743,174170,534707,674210,52.81490791,-8.968574513,http://www.buildingsofireland.ie/niah/images/survey_specific/fullsize/20404105_1.jpg,http://www.buildingsofireland.ie/niah/search.jsp?type=record&county=CL&regno=20404105,SURV023
20404106,Newhall House,,,,,NEWHALL,Clare,CL,CL,"Detached seven-bay two-storey red brick house, built c. 1765, with three-bay full-height balustraded canted central projection, single-bay full-height bow windows to side elevations and eight-bay two- and three-storey lower wing to rear.  Design attributed to architect Francis Bindon.  Possibly incorporating fabric of earlier building, c. 1650.  Hipped slate roof to main block, conical roofs to side bows and pitched roof to rear with cut-stone eaves course, brick chimneystacks, and balustrade to canted central projection.  Flemish bond brick walls with cut-stone string course and brick panels over first floor windows.  Timber sliding sash windows.  Carved limestone door surround comprising shouldered architrave with pediment above.  Timber panelled door.  Retaining interior features.  Pair of detached single-bay single-storey gate lodges with round-headed niches, lancet-arch openings and diagonal corner piers to site, now derelict.  Cut-stone piers with cast-iron gates and railings.",,1760,1770,National,country house,131807,173539,531772,673579,52.80887411,-9.01197696,http://www.buildingsofireland.ie/niah/images/survey_specific/fullsize/20404106_1.jpg,http://www.buildingsofireland.ie/niah/search.jsp?type=record&county=CL&regno=20404106,SURV023
