REG_NO,NAME,NUMBER,STREET1,STREET2,TOWN,TOWNLAND,COUNTY,COUNTY_ID,PLANAUTH,COMPOSITION,APPRAISAL,DATEFROM,DATETO,RATING,ORIGINAL_TYPE,X_COORD,Y_COORD,X_COORD_ITM,Y_COORD_ITM,LATITUDE,LONGITUDE,IMAGE_LINK,WEBSITE_LINK,SURVEY_ID
20300301,P. Crowley,,Main Street,,Corrofin,BAUNKYLE,Clare,CL,CL,"End-of-terrace six-bay two-storey house, built c. 1790.  Timber shopfront inserted, c. 1900, to left hand side.  Now also in use as public house.  Pitched artificial slate roof with rendered chimneystacks.  Lime-washed walls.  Shopfront comprising timber pilasters flanking tripartite fixed window and timber panelled doors with overlights, having fascia, marbleised lettering and cornice above.  Timber panelled door with overlight to right hand side.  Timber sliding sash windows with stone sills.  Steps leading to entrance door.  Stone kerbing to footpath.  Attached single-bay single-storey lean-to outbuilding to left.",,1780,1800,Regional,house,128547,188693,528513,688730,52.94460134,-9.063630339,http://www.buildingsofireland.ie/niah/images/survey_specific/fullsize/20300301_1.jpg,http://www.buildingsofireland.ie/niah/search.jsp?type=record&county=CL&regno=20300301,SURV023
20300302,Corrofin Bridge,,Corrofin,,Corrofin,BAUNKYLE,Clare,CL,CL,"Triple-arch hump-back road bridge over River Fergus, built c. 1790, with rubble stone walls, cut-stone voussoirs, coursed rubble buttresses and V-cutwaters.",,1780,1800,Regional,bridge,128650,188596,528616,688633,52.9437457,-9.062076049,http://www.buildingsofireland.ie/niah/images/survey_specific/fullsize/20300302_1.jpg,http://www.buildingsofireland.ie/niah/search.jsp?type=record&county=CL&regno=20300302,SURV023
20300303,Richmond House,,Main Street,,Corrofin,BAUNKYLE,Clare,CL,CL,"Detached five-bay two-storey house with dormer attic, built c. 1800, prostyle diastyle Doric portico added, c. 1840.  Pitched slate roof with rendered chimneystacks, gabled dormer windows and cast-iron rainwater goods.  Lined-and-ruled rendered walls with render quoins.  Round-headed door opening having cut-granite Gibbsian door surround with fluted keystone.  Timber panelled and glazed double leaf doors with radial fanlight.  Timber sliding sash window.  Timber casement windows to dormers.  Cobbled yard to rear.  Detached four-bay two-storey rubble stone coach house with dormer attic, built c. 1790, having lunette window openings to first floor.  Extensively renovated and subdivided, c. 1995, to accommodate use as apartments.  Remains of detached single-bay two-storey rubble stone building, now in ruins.  Cut-stone gate piers with obelisk pinnacles.",,1780,1820,Regional,house,128615,188635,528562,688666,52.94403075,-9.062893932,http://www.buildingsofireland.ie/niah/images/survey_specific/fullsize/20300303_1.jpg,http://www.buildingsofireland.ie/niah/search.jsp?type=record&county=CL&regno=20300303,SURV023
20300304,Sean Kenny and Sons,,Main Street,,Corrofin,KILVOYDAN,Clare,CL,CL,"Attached six-bay two-storey market house set on raised plinth, built 1876, incorporating fabric of earlier building, c. 1700.  Two-bay two-storey extension added to rear, c. 1985.  Pitched Moher flagged roof with rendered chimneystacks.  Single-pitched corrugated-iron roof to extension.  Rendered walls with cut-stone plinth and buttresses.  Inset crest and date plaque to front elevation.  Three round-headed openings to ground floor and square-headed openings to first floor, all with replacement timber windows.",,1875,1880,Regional,market house,128571,188704,528538,688741,52.94470058,-9.06327449,http://www.buildingsofireland.ie/niah/images/survey_specific/fullsize/20300304_1.jpg,http://www.buildingsofireland.ie/niah/search.jsp?type=record&county=CL&regno=20300304,SURV023
20300305,Saint Brigid's Roman Catholic Church,,Main Street (off),,Corrofin,KILVOYDAN,Clare,CL,CL,"Freestanding T-plan gable-fronted double-height Roman Catholic church, dated 1822, with three-bay gable front and two-bay nave.  Two-bay single-storey sacristy added to rear, c. 1995, with inset archaeological fragment to exterior wall.  Pitched artificial slate roof with bellcote over entrance gable having cross finial, moulded gable copings and cast-iron rainwater goods.  Snecked stone walls with cut-stone quoins, niche to gable and blind openings flanking entrance door.  Rendered walls to transepts.  Four-centred arch door opening with timber sheeted double leaf doors, fanlight and label moulding.  Lancet window openings, set in tripartite arrangement over entrance door.  Replacement uPVC windows.  Retaining interior features.  Cut-stone gate piers set in rubble stone walls to site.",,1820,1825,Regional,church/chapel,128595,188721,528561,688758,52.9448562,-9.062926115,http://www.buildingsofireland.ie/niah/images/survey_specific/fullsize/20300305_1.jpg,http://www.buildingsofireland.ie/niah/search.jsp?type=record&county=CL&regno=20300305,SURV023
20300306,Clare Heritage Centre,,Main Street (off),,Corrofin,LAGHTAGOONA,Clare,CL,CL,"Freestanding Church of Ireland church, built c. 1715, comprising four-bay double-height nave, with single-bay three-stage entrance tower and spire and single-bay single-storey vestry, added 1829.  Two-bay single-storey wing added, 1979-1982, to accommodate use as heritage centre.  Pitched slate roof with profile stone copings.  Needle spire and pinnacles to tower.  Rendered walls, render quoins and render architraves to nave.  Snecked limestone walls with corner buttresses, string courses and cut-stone window dressings to tower.  Carved memorial stone plaque beside door to extension.  Pointed arch door opening with timber doors and carved hood moulding.  Lancet windows with timber sliding sash windows.  Tripartite lancet chancel window with leaded stained glass.  Retaining interior features including marble memorials, timber pulpit, chancel arch and panelled gallery.  Graveyard to site with various cut-stone grave markers.  Cut-stone piers to site.",,1710,1720,Regional,church/chapel,128633,188798,528599,688835,52.94555692,-9.062377138,http://www.buildingsofireland.ie/niah/images/survey_specific/fullsize/20300306_1.jpg,http://www.buildingsofireland.ie/niah/search.jsp?type=record&county=CL&regno=20300306,SURV023
20300308,Cahirs,,Main Street,,Corrofin,BAUNKYLE,Clare,CL,CL,"Terraced two-bay two-storey house, built c. 1870, timber pubfront inserted, c. 1920.  Pitched artificial slate roof with rendered chimneystack.  Lined-and-ruled rendered walls.  Shopfront comprising pilasters flanking fixed window and timber panelled half glazed door with fascia and moulded cornice above.  Timber panelled door with overlight.  Timber sliding sash windows with stone sills.  Thick stone flag forms bridge over drain in footpath to front.",,1860,1880,Regional,house,128312,188867,528278,688904,52.94612845,-9.067169754,http://www.buildingsofireland.ie/niah/images/survey_specific/fullsize/20300308_1.jpg,http://www.buildingsofireland.ie/niah/search.jsp?type=record&county=CL&regno=20300308,SURV023
20300313,Studdert Mausoleum,,Main Street (off),,Corrofin,LAGHTAGOONA,Clare,CL,CL,"Freestanding single-bay single-storey part-sunken granite cut-stone Studdert family mausoleum, built c. 1820.  Recessed central cast-iron door flanked by engaged columns, approached by flight of steps and with inscribed plaque above.  Stepped pyramidal roof.",,1800,1840,Regional,mausoleum,128664,188818,528630,688856,52.94574402,-9.061929639,http://www.buildingsofireland.ie/niah/images/survey_specific/fullsize/20300313_1.jpg,http://www.buildingsofireland.ie/niah/search.jsp?type=record&county=CL&regno=20300313,SURV023
20000001,O'Connell Monument,,O'Connell Street,,Ennis,CLONROAD BEG,Clare,CL,EN,"Monument to Daniel O'Connell, erected 1867, in the form of a Roman Doric column set on a square-plan base having inset panels and surmounted with a limestone statue of a cloaked figure with raised hand facing up O'Connell Street.  The statue stands on a drum decorated with a scroll of shamrocks.  Set on the site of former courthouse, demolished 1852.",,1865,1870,National,monument,133846,177462,533811,677502,52.84437922,-8.982533985,http://www.buildingsofireland.ie/niah/images/survey_specific/fullsize/20000001_1.jpg,http://www.buildingsofireland.ie/niah/search.jsp?type=record&county=CL&regno=20000001,SURV023
20000002,Bank of Ireland,,O'Connell Square,,Ennis,CLONROAD BEG,Clare,CL,EN,"Corner-sited ten-bay three-storey purpose-built bank and bank manager's house, built 1874, with entrance bay set in curved corner.  Main façade comprises two-bays on each street flanking the entrance bay.  Five-bay block forms a subsidiary block along Bank Place.  Pitched slate roof.  Cut-limestone walls to ground floor, having cut-limestone pilasters with capitals and scrolls above, flanking the main façade openings.  Red brick walls to upper floors.  Limestone cornice and string courses between floors.  Timber panelled door and overlight set in recessed opening.  Timber sliding sash windows.  Segmental-arched openings to ground floor.  Square-headed openings with limestone architraves to first floor, having segmental pediments to main façade openings.  Segmental-arched openings to second floor with limestone architraves.  Retaining interior features.",,1870,1875,Regional,bank/financial institution,133806,177482,533771,677521,52.84454955,-8.983130241,http://www.buildingsofireland.ie/niah/images/survey_specific/fullsize/20000002_1.jpg,http://www.buildingsofireland.ie/niah/search.jsp?type=record&county=CL&regno=20000002,SURV023
20000006,Bank of Ireland,,Bank Place,,Ennis,LIFFORD,Clare,CL,EN,"Detached five-bay two-storey bank and bank manager’s house, built 1864, with three-bay central breakfront flanked by recessed entrance bays.  Hipped slate roof with cut stone chimneystacks having chamfered edges.  Cut-limestone walls with quoins to accentuating corners and breakfront, cut-stone pilasters flanking ground floor windows and carved colonnettes flanking entrance doors.  Dentillated string course between floors.  Bracketed eaves course.  Round-headed openings to ground floor with billeted carved detail to archivolts.  Timber sliding sash windows to breakfront.  Timber panelled doors with plain fanlights.  Shouldered square-headed openings to first floor with timber sliding sash windows.",,1860,1865,Regional,bank/financial institution,133734,177549,533699,677588,52.84514262,-8.984216862,http://www.buildingsofireland.ie/niah/images/survey_specific/fullsize/20000006_1.jpg,http://www.buildingsofireland.ie/niah/search.jsp?type=record&county=CL&regno=20000006,SURV023
20000007,,1,Bank Place,,Ennis,LIFFORD,Clare,CL,EN,"End-of-terrace two-bay three-storey over part-raised basement Victorian house, built c. 1865, with rectangular bay-window to ground floor and basement.  Built as part of a terrace of four houses.  Hipped slate roof with bracketed eaves and large chimneystack having yellow brick banding.  Red brick walls with yellow brick quoins, string courses and keystones.  Limestone walls to basement.  Timber sliding sash windows.  Timber door with overlight.  Limestone steps leading to entrance door.  Wrought-iron railings to steps and basement area.  Coach house to rear.",,1860,1870,Regional,house,133720,177551,533685,677591,52.84516525,-8.984428733,http://www.buildingsofireland.ie/niah/images/survey_specific/fullsize/20000007_1.jpg,http://www.buildingsofireland.ie/niah/search.jsp?type=record&county=CL&regno=20000007,SURV023
20000008,,2,Bank Place,,Ennis,LIFFORD,Clare,CL,EN,"Terraced two-bay three-storey over part raised basement Victorian house, built c. 1865, with rectangular bay-window to ground floor and basement.  Built as part of a terrace of four houses.  Pitched slate roof with bracketed eaves and large chimneystack having yellow brick banding.  Red brick walls with yellow brick quoins, string courses and keystones.  Limestone walls to basement.  Timber sliding sash windows.  Timber door with overlight.  Limestone steps leading to entrance door.  Wrought-iron railings to steps and basement area.  Coach house to rear.",,1860,1870,Regional,house,133714,177556,533679,677595,52.84520326,-8.984515417,http://www.buildingsofireland.ie/niah/images/survey_specific/fullsize/20000008_1.jpg,http://www.buildingsofireland.ie/niah/search.jsp?type=record&county=CL&regno=20000008,SURV023
20000009,,3,Bank Place,,Ennis,LIFFORD,Clare,CL,EN,"Terraced two-bay three-storey over part raised basement Victorian house, built c. 1865, with rectangular bay-window to ground floor and basement.  Built as part of a terrace of four houses.  Pitched slate roof with bracketed eaves and large chimneystack having yellow brick banding.  Red brick walls with yellow brick quoins, string courses and keystones.  Limestone walls to basement.  Timber sliding sash windows.  Timber door with overlight.  Limestone steps leading to entrance door.  Wrought-iron railings to steps and basement area.  Coach house to rear.",,1860,1870,Regional,house,133708,177560,533673,677599,52.84524025,-8.984601605,http://www.buildingsofireland.ie/niah/images/survey_specific/fullsize/20000009_1.jpg,http://www.buildingsofireland.ie/niah/search.jsp?type=record&county=CL&regno=20000009,SURV023
20000010,,4,Bank Place,,Ennis,LIFFORD,Clare,CL,EN,"End-of-terrace two-bay three-storey over part raised basement Victorian house, built c. 1865, with rectangular bay-window to ground floor and basement.  Built as part of a terrace of four houses.  Hipped slate roof with bracketed eaves and large chimneystack having yellow brick banding.  Red brick walls with yellow brick quoins, string courses and keystones.  Limestone walls to basement.  Timber sliding sash windows.  Timber door with overlight.  Limestone steps leading to entrance door.  Wrought-iron railings to steps and basement area.  Coach house to rear.",,1860,1870,Regional,house,133702,177564,533667,677604,52.84527742,-8.984690748,http://www.buildingsofireland.ie/niah/images/survey_specific/fullsize/20000010_1.jpg,http://www.buildingsofireland.ie/niah/search.jsp?type=record&county=CL&regno=20000010,SURV023
20000015,,,Bank Place,,Ennis,CLONROAD BEG,Clare,CL,EN,"Multiple-bay two and three-storey commercial  building, built c. 1875, with red brick facade over high shopfront having plaster cornice and fascia boards, c. 1920.",,1870,1880,Regional,shop/retail outlet,133782,177474,533747,677514,52.84447822,-8.983496358,http://www.buildingsofireland.ie/niah/images/survey_specific/fullsize/20000015_1.jpg,http://www.buildingsofireland.ie/niah/search.jsp?type=record&county=CL&regno=20000015,SURV023
20000016,Allied Irish Bank,,Bank Place,,Ennis,CLONROAD BEG,Clare,CL,EN,"Detached five-bay three-storey bank and manager’s house, built 1916, with advanced end bays.  Hipped slate roof with large brick chimney stacks and cut stone moulded cornices.  Channelled limestone walls to ground floor with rope moulding in string course at ground floor sill level.  Panelled brickwork to upper floors, with carved limestone stringcourse, cut-stone piers of raised quoins having swags to capitals, frieze cornice and blocking cornice.  Round-headed openings to ground floor.  Square-headed openings to upper floors with limestone lintels.",,1915,1920,Regional,bank/financial institution,133752,177485,533717,677525,52.84457324,-8.983935734,http://www.buildingsofireland.ie/niah/images/survey_specific/fullsize/20000016_1.jpg,http://www.buildingsofireland.ie/niah/search.jsp?type=record&county=CL&regno=20000016,SURV023
20000019,Saint Columba's Church of Ireland Church,,Bindon Street,,Ennis,LIFFORD,Clare,CL,EN,"Freestanding asymmetrical-plan French-Gothic style Church of Ireland church, dated 1871. Architect W.H.Lynn. Comprising wide nave with polygonal apse, equally wide north aisle, bell tower on north side and entrance porch on north side.  Pitched roof roofs with finials on gables.  Chimneystack for heating system shaped as round tower.  Saddleback roof to tower.  Rusticated limestone walls.  Paired lancet windows set in block-and-start dressed stone surrounds.  Lancet door opening to porch with short colonnettes having foliated stone capitals resting on plinths.  Open king post roof and lancet arches with foliate capitals to interior.  Retaining interior features including organ, added 1873, low arcaded reredos painted by Brigid Ganley and ceramic figures of saints by C. O’Brien, c. 1925.  Built on site donated by the Bindon Blood Family.",,1870,1875,Regional,church/chapel,133597,177590,533562,677629,52.84549522,-8.986256697,http://www.buildingsofireland.ie/niah/images/survey_specific/fullsize/20000019_1.jpg,http://www.buildingsofireland.ie/niah/search.jsp?type=record&county=CL&regno=20000019,SURV023
20000020,Allied Irish Bank,,Bindon Street,,Ennis,LIFFORD,Clare,CL,EN,"Detached five-bay two-storey Italianate-style bank and manager’s house, built 1864, with advanced single-storey entrance porch addition.  Two-storey hip-roofed side entrance extension to right.  Hipped slate roof with paired limestone stone brackets under moulded limestone eaves course.  Cut stone decoration to chimneystacks.  Limestone cut-stone walls with string courses at sill levels.  Gibbsian door surround flanked by engaged pilasters with moulded cornice above to porch.  Round-headed openings with roll mouldings and dropped keystones to ground floor.  Segmental-arched openings with architrave and dropped keystone to first floor.  Round-headed door opening to side entrance.  Timber sash windows and timber panelled doors to openings.",,1860,1865,Regional,bank/financial institution,133652,177601,533616,677641,52.84560434,-8.985453782,http://www.buildingsofireland.ie/niah/images/survey_specific/fullsize/20000020_1.jpg,http://www.buildingsofireland.ie/niah/search.jsp?type=record&county=CL&regno=20000020,SURV023
20000022,,6,Bindon Street,,Ennis,LIFFORD,Clare,CL,EN,"End-of-terrace two-bay four-storey over basement Georgian-style former townhouse, built 1832, now in use as office.  Built as part of a terrace of six houses.  Pitched slate roof with stone coping to parapet.  Red brick walls.  Plastered walls to gable.  Timber panelled door flanked by engaged fluted columns with moulded lintel and wrought-iron cobweb fanlight above.  Timber sliding sash windows.  Flight of limestone steps leading to entrance door.  Cast-iron railings to steps and basement area.  Yard to rear.",,1830,1835,Regional,house,133660,177622,533625,677661,52.84579093,-8.985334383,http://www.buildingsofireland.ie/niah/images/survey_specific/fullsize/20000022_1.jpg,http://www.buildingsofireland.ie/niah/search.jsp?type=record&county=CL&regno=20000022,SURV023
20000023,,5,Bindon Street,,Ennis,LIFFORD,Clare,CL,EN,"Terraced two-bay four-storey over basement Georgian-style former townhouse, built 1832, now in use as office.  Built as part of a terrace of six houses.  Pitched slate roof with stone coping to parapet.  Red brick walls.  Timber panelled door flanked by engaged fluted columns with moulded lintel and wrought-iron cobweb fanlight above.  Timber sliding sash windows.  Flight of limestone steps leading to entrance door.  Cast-iron railings to steps and basement area.  Yard to rear.",,1830,1835,Regional,house,133663,177629,533628,677668,52.84585249,-8.985291139,http://www.buildingsofireland.ie/niah/images/survey_specific/fullsize/20000023_1.jpg,http://www.buildingsofireland.ie/niah/search.jsp?type=record&county=CL&regno=20000023,SURV023
20000024,,4,Bindon Street,,Ennis,LIFFORD,Clare,CL,EN,"Terraced two-bay four-storey over basement Georgian-style former townhouse, built 1832, now in use as office.  Built as part of a terrace of six houses.  Pitched slate roof with downpipe to centre of facade.  Channelled render walls to ground floor.  Roughcast rendered walls to upper floors with render quoins.  Timber panelled door flanked by engaged fluted columns with moulded lintel and wrought-iron cobweb fanlight above.  Timber sliding sash windows with moulded lintels to upper floors.  Flight of limestone steps leading to entrance door.  Cast-iron railings to steps and basement area.  Yard to rear.",,1830,1835,Regional,house,133666,177635,533630,677675,52.84591209,-8.985252546,http://www.buildingsofireland.ie/niah/images/survey_specific/fullsize/20000024_1.jpg,http://www.buildingsofireland.ie/niah/search.jsp?type=record&county=CL&regno=20000024,SURV023
20000025,,3,Bindon Street,,Ennis,LIFFORD,Clare,CL,EN,"Terraced two-bay four-storey over basement Georgian-style former townhouse, built 1832, now in use as office.  Built as part of a terrace of six houses.  Pitched slate roof with downpipe to centre of facade.  Channelled render walls to ground floor.  Roughcast rendered walls to upper floors with render quoins.  Timber panelled door flanked by engaged fluted columns with moulded lintel and wrought-iron cobweb fanlight above.  Timber sliding sash windows with moulded lintels to upper floors.  Flight of limestone steps leading to entrance door.  Cast-iron railings to steps and basement area.  Yard to rear.",,1830,1835,Regional,house,133672,177641,533637,677680,52.84596296,-8.985162598,http://www.buildingsofireland.ie/niah/images/survey_specific/fullsize/20000025_1.jpg,http://www.buildingsofireland.ie/niah/search.jsp?type=record&county=CL&regno=20000025,SURV023
20000026,,2,Bindon Street,,Ennis,LIFFORD,Clare,CL,EN,"Terraced two-bay four-storey over basement Georgian-style former townhouse, built 1834, now in use as office.  Built as part of a terrace of six houses.  Pitched slate roof with stone coping to parapet.  Red brick walls.  Timber panelled door flanked by engaged fluted columns with moulded lintel and wrought-iron cobweb fanlight above.  Timber sliding sash windows.  Flight of limestone steps leading to entrance door.  Cast-iron railings to steps and basement area.  Yard to rear.",,1830,1835,Regional,house,133671,177649,533636,677689,52.84603705,-8.985175856,http://www.buildingsofireland.ie/niah/images/survey_specific/fullsize/20000026_1.jpg,http://www.buildingsofireland.ie/niah/search.jsp?type=record&county=CL&regno=20000026,SURV023
20000027,,1,Bindon Street,,Ennis,LIFFORD,Clare,CL,EN,"End-of-terrace two-bay four-storey over basement Georgian-style townhouse, built c. 1835.  Bay window added to ground floor and two-bay single-storey extension to left, c. 1850.  Built as part of a terrace of six houses.  Pitched slate roof with stone coping to parapet.  Red brick walls.  Limestone quoins to extension.  Pedimented limestone doorcase, added c. 1850.  Timber sliding sash windows.  Flight of limestone steps leading to entrance door.  Retaining interior features.  Cast-iron railings to steps and basement area.  Yard to rear.",,1830,1840,Regional,house,133673,177655,533638,677695,52.84609398,-8.985142659,http://www.buildingsofireland.ie/niah/images/survey_specific/fullsize/20000027_1.jpg,http://www.buildingsofireland.ie/niah/search.jsp?type=record&county=CL&regno=20000027,SURV023
20000028,,7,Bindon Street,,Ennis,LIFFORD,Clare,CL,EN,"End-of-terrace two-bay three-storey over basement Georgian style former townhouse, built c. 1835, as part of a terrace of five houses.  Now in use as offices.  Pitched slate roof with rendered chimneystacks.  Red brick walls.  Timber panelled door flanked by pilasters with radial fanlight above.  Timber sliding sash windows.  Cast-iron railings surrounding basement area.  Outbuildings to rear.",,1830,1840,Regional,house,133622,177616,533587,677656,52.84573612,-8.985889462,http://www.buildingsofireland.ie/niah/images/survey_specific/fullsize/20000028_1.jpg,http://www.buildingsofireland.ie/niah/search.jsp?type=record&county=CL&regno=20000028,SURV023
20000029,,8,Bindon Street,,Ennis,LIFFORD,Clare,CL,EN,"Terraced two-bay three-storey over basement Georgian style former townhouse, built c. 1835, as part of a terrace of five houses.  Now in use as offices.  Pitched slate roof with rendered chimneystacks.  Red brick walls.  Timber panelled door flanked by pilasters with radial fanlight above.  Timber sliding sash windows.  Cast-iron railings surrounding basement area.  Outbuildings to rear.",,1830,1840,Regional,house,133625,177622,533590,677662,52.84578841,-8.98584958,http://www.buildingsofireland.ie/niah/images/survey_specific/fullsize/20000029_1.jpg,http://www.buildingsofireland.ie/niah/search.jsp?type=record&county=CL&regno=20000029,SURV023
20000030,,9,Bindon Street,,Ennis,LIFFORD,Clare,CL,EN,"Terraced two-bay three-storey over basement Georgian style former townhouse, built c. 1835, as part of a terrace of five houses.  Now in use as offices.  Pitched slate roof with rendered chimneystacks.  Red brick walls.  Timber panelled door flanked by pilasters with radial fanlight above.  Timber sliding sash windows.  Cast-iron railings surrounding basement area.  Outbuildings to rear.",,1830,1840,Regional,house,133627,177628,533592,677667,52.84583891,-8.985826876,http://www.buildingsofireland.ie/niah/images/survey_specific/fullsize/20000030_1.jpg,http://www.buildingsofireland.ie/niah/search.jsp?type=record&county=CL&regno=20000030,SURV023
20000031,,10,Bindon Street,,Ennis,LIFFORD,Clare,CL,EN,"Terraced two-bay three-storey over basement Georgian style former townhouse, built c. 1835, as part of a terrace of five houses.  Now in use as offices.  Pitched slate roof with rendered chimneystacks and dormer window additions.  Red brick walls.  Timber panelled door flanked by pilasters with radial fanlight above.  Timber sliding sash windows.  Cast-iron railings surrounding basement area.  Outbuildings to rear.",,1830,1840,Regional,house,133628,177634,533593,677674,52.84589812,-8.985814888,http://www.buildingsofireland.ie/niah/images/survey_specific/fullsize/20000031_1.jpg,http://www.buildingsofireland.ie/niah/search.jsp?type=record&county=CL&regno=20000031,SURV023
