REG_NO,NAME,NUMBER,STREET1,STREET2,TOWN,TOWNLAND,COUNTY,COUNTY_ID,PLANAUTH,COMPOSITION,APPRAISAL,DATEFROM,DATETO,RATING,ORIGINAL_TYPE,X_COORD,Y_COORD,X_COORD_ITM,Y_COORD_ITM,LATITUDE,LONGITUDE,IMAGE_LINK,WEBSITE_LINK,SURVEY_ID
12802825,Donaghmore Church of Ireland Church,,,,Donaghmore,DONAGHMORE,Laois,LA,LA,"Detached three-bay Georgian Gothic Church of Ireland church, dated 1821, with tower and vestry projection. Plaque above entrance reads : ""This church built in the year 1821/during the episcopacy of the Right Rev Robert/Fowler Lord Biship of Ossory/The Revd John Lowry Rector/Revd Richard Kennedy and Mr Luke Kingsmill/church wardens/Mr Patrick Bergin Architect/total expence 520 pounds sterl"".",,1815,1825,Regional,church/chapel,226978,180236,626923,680274,52.87269097,-7.600087002,http://www.buildingsofireland.ie/niah/images/survey_specific/fullsize/12802825_1.jpg,http://www.buildingsofireland.ie/niah/search.jsp?type=record&county=LA&regno=12802825,SURV014
12802826,Mooney's,,,,Donaghmore,DONAGHMORE,Laois,LA,LA,"Detached four-bay two-storey house, c. 1900, with full-height return to rear. Renovated and extended to rear, c. 1990, comprising single-storey return with replacement pubfront inserted to ground floor.",,1885,1910,Regional,public house,226732,180147,626677,680186,52.87190592,-7.60375209,http://www.buildingsofireland.ie/niah/images/survey_specific/fullsize/12802826_1.jpg,http://www.buildingsofireland.ie/niah/search.jsp?type=record&county=LA&regno=12802826,SURV014
12802827,,,,,Donaghmore,DONAGHMORE,Laois,LA,LA,"Detached five-bay two-storey house, c. 1850. Group of detached outbuildings to side and to rear.",,1820,1860,Regional,house,226666,180224,626610,680262,52.87259421,-7.604732226,http://www.buildingsofireland.ie/niah/images/survey_specific/fullsize/12802827_1.jpg,http://www.buildingsofireland.ie/niah/search.jsp?type=record&county=LA&regno=12802827,SURV014
12802828,,,,,Donaghmore,DONAGHMORE,Laois,LA,LA,"Corn mill and malting complex, c. 1930, comprising group of detached buildings (located on either side of river) including three-storey store. Now derelict. Remainder of outbuildings renovated, c. 1990.",,1800,1850,Regional,mill (water),226729,180289,626674,680328,52.87318215,-7.603787789,http://www.buildingsofireland.ie/niah/images/survey_specific/fullsize/12802828_1.jpg,http://www.buildingsofireland.ie/niah/search.jsp?type=record&county=LA&regno=12802828,SURV014
12802829,Saint Columba's Catholic Church,,,,,MOUNTOLIVER,Laois,LA,LA,"Detached four-bay Catholic church, c. 1840, on a T-shaped plan with sacristy projection to rear. Now disused.",,1810,1850,Regional,church/chapel,225083,178788,625028,678826,52.85976864,-7.628343282,http://www.buildingsofireland.ie/niah/images/survey_specific/fullsize/12802829_1.jpg,http://www.buildingsofireland.ie/niah/search.jsp?type=record&county=LA&regno=12802829,SURV014
12802830,Saint Canice's Catholic Church,,,,Clogh,RAHANDRICK LOWER,Laois,LA,LA,"Detached Gothic Revival Catholic church, dated 1871, with tower to corner and side aisles. Interior retains gallery.",,1870,1875,Regional,church/chapel,232772,181698,632716,681736,52.88551021,-7.513898875,http://www.buildingsofireland.ie/niah/images/survey_specific/fullsize/12802830_1.jpg,http://www.buildingsofireland.ie/niah/search.jsp?type=record&county=LA&regno=12802830,SURV014
12802934,Ballacolla School,,,,Ballacolla,PARK (CM. BY.),Laois,LA,LA,"Detached single-storey school, dated 1889, with gabled projecting porch. Extended to rear, c. 1975.",,1880,1890,Regional,school,237411,181503,637353,681541,52.88345015,-7.445021255,http://www.buildingsofireland.ie/niah/images/survey_specific/fullsize/12802934_1.jpg,http://www.buildingsofireland.ie/niah/search.jsp?type=record&county=LA&regno=12802934,SURV014
12802935,Killermogh Church of Ireland Church,,,,,RATHMAKELLY GLEBE,Laois,LA,LA,"Detached two-bay Georgian Gothic Church of Ireland church, c. 1800, with tower, chancel and vestry projection.",,1780,1820,Regional,church/chapel,236463,180195,636406,680234,52.87176713,-7.459243476,http://www.buildingsofireland.ie/niah/images/survey_specific/fullsize/12802935_1.jpg,http://www.buildingsofireland.ie/niah/search.jsp?type=record&county=LA&regno=12802935,SURV014
12802936,Rathmakelly Glebe,,,,,RATHMAKELLY GLEBE,Laois,LA,LA,"Detached three-bay two-storey rectory, c. 1840. Group of detached single-storey outbuildings to side.",,1810,1850,Regional,rectory/glebe/vicarage/curate's house,236372,180189,636314,680227,52.871717,-7.460600834,http://www.buildingsofireland.ie/niah/images/survey_specific/fullsize/12802936_1.jpg,http://www.buildingsofireland.ie/niah/search.jsp?type=record&county=LA&regno=12802936,SURV014
12802937,Bluegate Cottages,,,,,KILLAMUCK,Laois,LA,LA,"Group of fourteen semi-detached two-storey estate houses, c. 1890. Individually renovated. Arranged in seven pairs.",,1880,1900,Regional,worker's house,242901,182278,642842,682316,52.8900053,-7.363368381,http://www.buildingsofireland.ie/niah/images/survey_specific/fullsize/12802937_1.jpg,http://www.buildingsofireland.ie/niah/search.jsp?type=record&county=LA&regno=12802937,SURV014
12802938,Bluegate House,,Abbeyleix Demesne,,,ABBEYLEIX DEMESNE,Laois,LA,LA,"Detached single-storey Tudor Revival former school with dormer attic, c. 1880, on a cruciform plan with gabled canopy over door opening and projecting porch to side. Now in residential use.",,1870,1900,Regional,school,242857,182281,642799,682319,52.89003798,-7.364015568,http://www.buildingsofireland.ie/niah/images/survey_specific/fullsize/12802938_1.jpg,http://www.buildingsofireland.ie/niah/search.jsp?type=record&county=LA&regno=12802938,SURV014
12802939,Newtown Bridge,,,,,BALLYBOODIN,Laois,LA,LA,"Four-arch rubble limestone road bridge over river Goul, c. 1770, with triangular cut-waters having U-shaped recess over to one side. Reinforced, c. 1975, with concrete.",,1740,1790,Regional,bridge,236348,177365,636290,677404,52.84634474,-7.461271307,http://www.buildingsofireland.ie/niah/images/survey_specific/fullsize/12802939_1.jpg,http://www.buildingsofireland.ie/niah/search.jsp?type=record&county=LA&regno=12802939,SURV014
12802940,Newtown Mills,,,,,NEWTOWN (CM. BY.),Laois,LA,LA,"Detached ten-bay four-storey corn mill, c. 1880. Detached two-storey over basement mill house, c. 1840, to site.",,1840,1900,Regional,mill (water),236468,177329,636410,677368,52.8460119,-7.459491873,http://www.buildingsofireland.ie/niah/images/survey_specific/fullsize/12802940_1.jpg,http://www.buildingsofireland.ie/niah/search.jsp?type=record&county=LA&regno=12802940,SURV014
12802942,Moyne House,,Moyne Demesne,,,MOYNE,Laois,LA,LA,"Detached five-bay two-storey house with dormer attic, c. 1730, with pedimented bay to centre having projecting porch to ground floor. Renovated and extended, c. 1880, comprising two-bay two-storey wings with dormer attic to left having box bay windows to ground floor.",,1720,1750,Regional,country house,239682,179543,639624,679581,52.86567669,-7.411520798,http://www.buildingsofireland.ie/niah/images/survey_specific/fullsize/12802942_1.jpg,http://www.buildingsofireland.ie/niah/search.jsp?type=record&county=LA&regno=12802942,SURV014
12802943,Abbeyleix House,,Abbeyleix Demesne,,,ABBEYLEIX DEMESNE,Laois,LA,LA,"Underground passage, c. 1840, connecting stable complex to Home Farm with gable-fronted entrance bay to south and series of open rooflights to east.",,1820,1860,Regional,tunnel,242192,183118,642133,683156,52.89761213,-7.37379483,http://www.buildingsofireland.ie/niah/images/survey_specific/fullsize/12802943_1.jpg,http://www.buildingsofireland.ie/niah/search.jsp?type=record&county=LA&regno=12802943,SURV014
12802944,Abbeyleix House,,Abbeyleix Demesne,,,ABBEYLEIX DEMESNE,Laois,LA,LA,"Freestanding stone icehouse, c. 1800, with pedimented entrance bay to north having segmental-headed door opening; now disused and mostly ovegrown.",,1780,1820,Regional,icehouse,242197,183266,642139,683303,52.89893632,-7.373696924,http://www.buildingsofireland.ie/niah/images/survey_specific/fullsize/12802944_1.jpg,http://www.buildingsofireland.ie/niah/search.jsp?type=record&county=LA&regno=12802944,SURV014
12802945,Knapton's Bridge (Monk's Bridge),,Abbeyleix Demesne,,,ABBEYLEIX DEMESNE,Laois,LA,LA,"Eight-arch rubble stone road bridge over river, c. 1775, with rubble stone voussoirs and cut stone triangular cut-waters to north.",,1760,1790,Regional,bridge,241897,183225,641838,683263,52.89859765,-7.378161924,http://www.buildingsofireland.ie/niah/images/survey_specific/fullsize/12802945_1.jpg,http://www.buildingsofireland.ie/niah/search.jsp?type=record&county=LA&regno=12802945,SURV014
12802946,Abbeyleix House,,Abbeyleix Demesne,,,ABBEYLEIX DEMESNE,Laois,LA,LA,"Viewing/fishing platform over river, c. 1840, on a half-octagonal plan with sections of wrought-iron railings having concrete piers and urns.",,1830,1850,Regional,building misc,241906,183064,641847,683102,52.89714958,-7.378050241,http://www.buildingsofireland.ie/niah/images/survey_specific/fullsize/12802946_1.jpg,http://www.buildingsofireland.ie/niah/search.jsp?type=record&county=LA&regno=12802946,SURV014
12802947,Abbeyleix House,,Abbeyleix Demesne,,,ABBEYLEIX DEMESNE,Laois,LA,LA,"Freestanding six-bay single-storey boathouse, c. 1850, with yellow brick piers and open gable ends.",,1840,1860,Regional,boathouse,241990,183005,641931,683043,52.89661259,-7.37681134,http://www.buildingsofireland.ie/niah/images/survey_specific/fullsize/12802947_1.jpg,http://www.buildingsofireland.ie/niah/search.jsp?type=record&county=LA&regno=12802947,SURV014
12803008,Heywood Gardens,,Heywood Demesne,,,HAYWOOD DEMESNE,Laois,LA,LA,"Arts-and-Crafts style ornamental garden, completed 1912, comprising stone walled garden on a circular plan with summerhouse and fountain. Designed by Sir Edwin Lutyens and planted by Gertrude Jekyll.",,1910,1915,National,garden,247078,181722,647018,681759,52.8846573,-7.30140068,http://www.buildingsofireland.ie/niah/images/survey_specific/fullsize/12803008_1.jpg,http://www.buildingsofireland.ie/niah/search.jsp?type=record&county=LA&regno=12803008,SURV014
12803009,Heywood Gardens,,Heywood Demesne,,,HAYWOOD DEMESNE,Laois,LA,LA,"Freestanding boathouse, c. 1800, with two vaulted chamfers.",,1775,1810,Regional,boathouse,246961,181815,646902,681853,52.88550491,-7.303117933,http://www.buildingsofireland.ie/niah/images/survey_specific/fullsize/12803009_1.jpg,http://www.buildingsofireland.ie/niah/search.jsp?type=record&county=LA&regno=12803009,SURV014
12803013,Heywood Gardens,,Heywood Demesne,,,HAYWOOD DEMESNE,Laois,LA,LA,"Freestanding Ziggurat type neo-Classical mausoleum, c. 1790.",,1780,1820,Regional,mausoleum,247399,181430,647339,681468,52.88200733,-7.296672558,http://www.buildingsofireland.ie/niah/images/survey_specific/fullsize/12803013_1.jpg,http://www.buildingsofireland.ie/niah/search.jsp?type=record&county=LA&regno=12803013,SURV014
12803101,,,,,,MONAVEA,Laois,LA,LA,"Freestanding limestone ashlar milestone, c. 1800, on a square plan.",,1780,1820,Regional,milestone/milepost,262025,177781,661963,677819,52.84773617,-7.080131149,http://www.buildingsofireland.ie/niah/images/survey_specific/fullsize/12803101_1.jpg,http://www.buildingsofireland.ie/niah/search.jsp?type=record&county=LA&regno=12803101,SURV014
12803103,Fleming's Fireclays,,,,,SLATT LOWER,Laois,LA,LA,"Pair of freestanding brick firing kilns, c. 1935, on hemispherical plans. Pair of freestanding chimneys, dated 1948 and 1953, to site.",,1930,1940,Regional,kiln,256611,182259,656549,682296,52.88856539,-7.159712131,http://www.buildingsofireland.ie/niah/images/survey_specific/fullsize/12803103_1.jpg,http://www.buildingsofireland.ie/niah/search.jsp?type=record&county=LA&regno=12803103,SURV014
12803104,Fleming's Fireclays,,,,,SLATT LOWER,Laois,LA,LA,"Detached four-bay single-storey brick factory manager's house with dormer attic, c. 1940, on an L-shaped plan with half-hipped gabled bay to left. Plaque on west wall commemorates Patrick Joseph Fleming, Patron of Works and Patriot.",,1935,1950,Regional,house,256622,182243,656561,682281,52.88842715,-7.159542564,http://www.buildingsofireland.ie/niah/images/survey_specific/fullsize/12803104_1.jpg,http://www.buildingsofireland.ie/niah/search.jsp?type=record&county=LA&regno=12803104,SURV014
12803201,Church of the Sacred Heart,,,,Arless,BALLYNAGALL,Laois,LA,LA,"Detached Gothic Revival Catholic church, built 1865, with tower, side aisles, polygonal chancel and sacristy projection to rear. Designed by Pugin and Ashlin, architects.",,1860,1870,Regional,church/chapel,265966,182889,665902,682927,52.8931676,-7.020623687,http://www.buildingsofireland.ie/niah/images/survey_specific/fullsize/12803201_1.jpg,http://www.buildingsofireland.ie/niah/search.jsp?type=record&county=LA&regno=12803201,SURV014
12803202,Grace Mausoleum,,,,Arless,BALLYNAGALL,Laois,LA,LA,"Freestanding Georgian Gothic mausoleum, dated 1818. Wall-mounted memorial plaques date to pre-1818.",,1815,1820,Regional,mausoleum,265971,182860,665908,682897,52.8928985,-7.020546653,http://www.buildingsofireland.ie/niah/images/survey_specific/fullsize/12803202_1.jpg,http://www.buildingsofireland.ie/niah/search.jsp?type=record&county=LA&regno=12803202,SURV014
12803203,Providence Lodge,,,,Ballickmoyler,BALLICKMOYLER,Laois,LA,LA,"Detached five-bay two-storey house, c. 1830, with return to rear. Detached two-storey stable building to rear.",,1820,1840,Regional,house,266353,181693,666289,681730,52.88236753,-7.015112412,http://www.buildingsofireland.ie/niah/images/survey_specific/fullsize/12803203_1.jpg,http://www.buildingsofireland.ie/niah/search.jsp?type=record&county=LA&regno=12803203,SURV014
12803204,Ashfield Hall,,Ashfield Demesne,,,ASHFIELD,Laois,LA,LA,"Detached five-bay two-storey Palladian style house with dormer attic, c. 1750, with pedimented advanced entrance bay. Now derelict.",,1730,1770,Regional,house,265016,182121,664953,682159,52.8863804,-7.034881057,http://www.buildingsofireland.ie/niah/images/survey_specific/fullsize/12803204_1.jpg,http://www.buildingsofireland.ie/niah/search.jsp?type=record&county=LA&regno=12803204,SURV014
12803205,Ashfield Hall,,Ashfield Demesne,,,ASHFIELD,Laois,LA,LA,"Detached three-bay single-storey Tudor Gothic style gate lodge with dormer attic, c. 1870, with gabled projecting entrance bay, oriel window and box bay window to right. Extended to rear comprising lean-to return. Now derelict.",,1860,1900,Regional,gate lodge,265303,181808,665239,681846,52.88353599,-7.030686903,http://www.buildingsofireland.ie/niah/images/survey_specific/fullsize/12803205_1.jpg,http://www.buildingsofireland.ie/niah/search.jsp?type=record&county=LA&regno=12803205,SURV014
12803206,Cooper's Hill House,,Coopershill Demesne,,,COOPERHILL DEMESNE,Laois,LA,LA,"Detached five-bay three-storey early-Georgian house, dated 1717. Extended, c. 1775. Extended, c. 1860, comprising four-bay two-storey wing.",,1715,1720,Regional,country house,267397,180901,667333,680939,52.87512572,-6.999775565,http://www.buildingsofireland.ie/niah/images/survey_specific/fullsize/12803206_1.jpg,http://www.buildingsofireland.ie/niah/search.jsp?type=record&county=LA&regno=12803206,SURV014
12803207,Church of the Holy Cross,,,,,KILLESHIN,Laois,LA,LA,"Detached six-bay Georgian Gothic style Catholic church, c. 1820, with tower, corner turrets on octagonal plans and gabled sacristy projection. Renovated, c. 1985, with interior remodelled.",,1815,1825,Regional,church/chapel,267603,177860,667539,677898,52.84777439,-6.997342329,http://www.buildingsofireland.ie/niah/images/survey_specific/fullsize/12803207_1.jpg,http://www.buildingsofireland.ie/niah/search.jsp?type=record&county=LA&regno=12803207,SURV014
12803208,Anneville House,,,,,ANNEVILLE,Laois,LA,LA,"Detached three-bay two-storey house, c. 1890, incorporating fabric of earlier house, c. 1800, to rear.",,1870,1900,Regional,house,270646,181834,670582,681872,52.88309553,-6.951320182,http://www.buildingsofireland.ie/niah/images/survey_specific/fullsize/12803208_1.jpg,http://www.buildingsofireland.ie/niah/search.jsp?type=record&county=LA&regno=12803208,SURV014
12803209,Hollymount House,,,,,HOLLYMOUNT,Laois,LA,LA,"Detached three-bay two-storey over basement Georgian house, c. 1800, with full-height bow to rear. Extended to right comprising two-bay two-storey range. Four-bay two-storey stable block.",,1780,1820,Regional,house,270050,181659,669985,681697,52.88159912,-6.960218802,http://www.buildingsofireland.ie/niah/images/survey_specific/fullsize/12803209_1.jpg,http://www.buildingsofireland.ie/niah/search.jsp?type=record&county=LA&regno=12803209,SURV014
12803401,Aghmacart Church of Ireland Church,,,,,AGHMACART,Laois,LA,LA,"Detached two-bay gable-fronted Church of Ireland church, c. 1820, with gabled projecting porch and bellcote to gable.",,1800,1835,Regional,church/chapel,233080,174472,633023,674511,52.82055497,-7.510061076,http://www.buildingsofireland.ie/niah/images/survey_specific/fullsize/12803401_1.jpg,http://www.buildingsofireland.ie/niah/search.jsp?type=record&county=LA&regno=12803401,SURV014
12803402,Belmont House,,,,,AGHMACART,Laois,LA,LA,"Detached single-storey house, c. 1860, with loggia to front, canted bay windows and advanced end bays.",,1830,1870,Regional,house,233715,174727,633658,674767,52.82281219,-7.500620821,http://www.buildingsofireland.ie/niah/images/survey_specific/fullsize/12803402_1.jpg,http://www.buildingsofireland.ie/niah/search.jsp?type=record&county=LA&regno=12803402,SURV014
12803501,Saint Brigid's Church of Ireland Church,,,,Attanagh,GLEBE (CM. BY.) DURROW ED,Laois,LA,LA,"Detached three-bay Georgian Gothic Church of Ireland church, built 1821. Renovated, c. 1860, with tower, projecting porch and vestry projection added. Now disused.",,1820,1825,Regional,church/chapel,244112,175967,644053,676006,52.83320072,-7.346234805,http://www.buildingsofireland.ie/niah/images/survey_specific/fullsize/12803501_1.jpg,http://www.buildingsofireland.ie/niah/search.jsp?type=record&county=LA&regno=12803501,SURV014
12803502,Glebe Rectory,,,,Attanagh,GLEBE (CM. BY.) DURROW ED,Laois,LA,LA,"Detached three-bay two-storey former rectory, c. 1750. Extended, c. 1825, comprising five-bay range. Detached three-bay coach house, c. 1750, to site with pedimented central breakfront. Detached gate lodge, c. 1850, to site.",,1740,1760,Regional,rectory/glebe/vicarage/curate's house,244069,175851,644010,675890,52.83216291,-7.346884681,http://www.buildingsofireland.ie/niah/images/survey_specific/fullsize/12803502_1.jpg,http://www.buildingsofireland.ie/niah/search.jsp?type=record&county=LA&regno=12803502,SURV014
12803503,Grenan School,,,,Attanagh,GRENAN,Laois,LA,LA,"Detached three-bay single-storey former school, c. 1880, with gabled projecting entrance bay. Now in residential use.",,1870,1900,Regional,school,244043,176044,643984,676083,52.8338976,-7.347239084,http://www.buildingsofireland.ie/niah/images/survey_specific/fullsize/12803503_1.jpg,http://www.buildingsofireland.ie/niah/search.jsp?type=record&county=LA&regno=12803503,SURV014
12803505,Grennan House,,,,,GRENAN,Laois,LA,LA,"Detached five-bay two-storey over basement house with part dormer attic, begun c. 1650, with single-bay single-storey wing to right and series of returns to rear. Stable complex to site.",,1620,1750,National,house,243053,175597,642995,675636,52.82996166,-7.36198382,http://www.buildingsofireland.ie/niah/images/survey_specific/fullsize/12803505_1.jpg,http://www.buildingsofireland.ie/niah/search.jsp?type=record&county=LA&regno=12803505,SURV014
12803506,Tallyho Bridge,,,,,TINWEAR,Laois,LA,LA,"Five-arch limestone road bridge over river Nore, c. 1800, with triangular cut-waters.",,1770,1800,Regional,bridge,242329,176227,642270,676266,52.83568305,-7.372650978,http://www.buildingsofireland.ie/niah/images/survey_specific/fullsize/12803506_1.jpg,http://www.buildingsofireland.ie/niah/search.jsp?type=record&county=LA&regno=12803506,SURV014
12803507,Knocknatrina House,,,,,DURROW TOWNPARKS,Laois,LA,LA,"Detached two-storey Tudor Revival former house, c. 1860, with canted bay windows, full-height gabled bowed bays and two-storey wing. Now in ruins. Stable complex to rear.",,1840,1870,Regional,house,241737,176789,641679,676829,52.84078208,-7.381359275,http://www.buildingsofireland.ie/niah/images/survey_specific/fullsize/12803507_1.jpg,http://www.buildingsofireland.ie/niah/search.jsp?type=record&county=LA&regno=12803507,SURV014
12803509,Clonageera House,,,,,CLONAGEERA,Laois,LA,LA,"Detached three-bay two-storey over basement Georgian house, completed 1803, with Doric portico to front and incorporating fabric of earlier house, c. 1725, to rear. Stable complex to site. Walled garden to site on a circular plan.",,1795,1805,Regional,house,240693,175881,640634,675920,52.83269525,-7.39697109,http://www.buildingsofireland.ie/niah/images/survey_specific/fullsize/12803509_1.jpg,http://www.buildingsofireland.ie/niah/search.jsp?type=record&county=LA&regno=12803509,SURV014
12803512,Edmondsbury House,,,,,NEWTOWN (CM. BY.),Laois,LA,LA,"Detached five-bay two-storey early-Georgian house, c. 1740. Extended, c. 1990, comprising three-bay single-storey wing.",,1730,1750,Regional,house,236725,176462,636667,676501,52.83820248,-7.455774564,http://www.buildingsofireland.ie/niah/images/survey_specific/fullsize/12803512_1.jpg,http://www.buildingsofireland.ie/niah/search.jsp?type=record&county=LA&regno=12803512,SURV014
12803702,Killeshin Church of Ireland Church,,,,,GRAIGUE (SL. BY.),Laois,LA,LA,"Detached six-bay Georgian Gothic style Church of Ireland church, c. 1830, with spire and chancel.",,1825,1835,Regional,church/chapel,271074,177008,671009,677047,52.83967928,-6.9460236,http://www.buildingsofireland.ie/niah/images/survey_specific/fullsize/12803702_1.jpg,http://www.buildingsofireland.ie/niah/search.jsp?type=record&county=LA&regno=12803702,SURV014
12803703,Everton House,,,,,OLDDERRIG,Laois,LA,LA,"Detached five-bay two-storey Georgian house, c. 1800, on an L-shaped plan with entrance bay having full-height flanking bows and bowed ends. Extended comprising three-bay two-storey wing.",,1790,1825,Regional,house,269757,176228,669692,676267,52.8328381,-6.965728299,http://www.buildingsofireland.ie/niah/images/survey_specific/fullsize/12803703_1.jpg,http://www.buildingsofireland.ie/niah/search.jsp?type=record&county=LA&regno=12803703,SURV014
12803704,Springhill House,,,,,SPRINGHILL (SL. BY.),Laois,LA,LA,"Detached five-bay three-storey Georgian house, c. 1740. Group of detached outbuildings to site.",,1730,1780,Regional,house,268365,175986,668301,676025,52.83084768,-6.986426927,http://www.buildingsofireland.ie/niah/images/survey_specific/fullsize/12803704_1.jpg,http://www.buildingsofireland.ie/niah/search.jsp?type=record&county=LA&regno=12803704,SURV014
12900101,Tinneel Society of Friends Burial Ground,,,,Rosenallis,TINNEEL,Laois,LA,LA,"Quaker graveyard with various plots, c. 1725 to the present. Gateway, c. 1800, to site.",,1710,1750,Regional,graveyard/cemetery,240060,209392,640002,709424,53.13384771,-7.402219087,http://www.buildingsofireland.ie/niah/images/survey_specific/fullsize/12900101_1.jpg,http://www.buildingsofireland.ie/niah/search.jsp?type=record&county=LA&regno=12900101,SURV014
12900102,Saint Mary's Church of Ireland Church,,,,Rosenallis,ROSENALLIS,Laois,LA,LA,"Detached gable-fronted Church of Ireland church, c. 1795. Renovated, 1830, with chancel added. Extended, c. 1865, with tower and side aisle added. Renovated, c. 1980.",,1790,1800,Regional,church/chapel,239786,209650,639728,709682,53.13618275,-7.406270664,http://www.buildingsofireland.ie/niah/images/survey_specific/fullsize/12900102_1.jpg,http://www.buildingsofireland.ie/niah/search.jsp?type=record&county=LA&regno=12900102,SURV014
12900104,,,,,Rosenallis,CORBALLY (TI. BY.) MEELICK ED,Laois,LA,LA,"Detached four-bay two-storey house, c. 1840.",,1800,1850,Regional,house,239655,209512,639597,709544,53.13495177,-7.408245451,http://www.buildingsofireland.ie/niah/images/survey_specific/fullsize/12900104_1.jpg,http://www.buildingsofireland.ie/niah/search.jsp?type=record&county=LA&regno=12900104,SURV014
12900105,Saint Brigid's Well,,,,Rosenallis,ROSENALLIS,Laois,LA,LA,"Freestanding Gothic arch enclosure, c. 1800, over holy well.",,1780,1820,Regional,shrine/oratory/grotto,239710,209582,639652,709614,53.13557353,-7.407423785,http://www.buildingsofireland.ie/niah/images/survey_specific/fullsize/12900105_1.jpg,http://www.buildingsofireland.ie/niah/search.jsp?type=record&county=LA&regno=12900105,SURV014
12900106,,,,,Rosenallis,ROSENALLIS,Laois,LA,LA,"Terraced five-bay two-storey house, dated 1733, possibly originally detached. Originally thatched. Extensively renovated, c. 1980, to accommodate commercial use.",,1730,1735,Regional,house,239714,209592,639656,709624,53.13567156,-7.407361219,http://www.buildingsofireland.ie/niah/images/survey_specific/fullsize/12900106_1.jpg,http://www.buildingsofireland.ie/niah/search.jsp?type=record&county=LA&regno=12900106,SURV014
12900109,Capard Windmill,,Capard,,Rosenallis,CAPARD,Laois,LA,LA,"Remains of freestanding former windmill, c. 1840, comprising stump on a circular plan. Now in ruins.",,1820,1870,Regional,mill (wind),239409,208960,639351,708992,53.1300109,-7.41199365,http://www.buildingsofireland.ie/niah/images/survey_specific/fullsize/12900109_1.jpg,http://www.buildingsofireland.ie/niah/search.jsp?type=record&county=LA&regno=12900109,SURV014
12900110,Saint Brigid's Catholic Church,,Capard,,Rosenallis,CAPARD,Laois,LA,LA,"Gateway, c. 1860, comprising piers with rubble stone walls having cut limestone stiles and wrought-iron gates. Site of former Church to site. Church now demolished with site cleared.",,1855,1865,Regional,building misc,239439,208965,639381,708997,53.13005103,-7.411543968,http://www.buildingsofireland.ie/niah/images/survey_specific/fullsize/12900110_1.jpg,http://www.buildingsofireland.ie/niah/search.jsp?type=record&county=LA&regno=12900110,SURV014
